Link,Title,Platform,Level
/course/valle-de-los-reyes-8793,El Valle de los Reyes,coursera,beginner
/course/structures-1187,L'art des structures 1 : Câbles et arcs,coursera,beginner
/course/initprogjava-643,Initiation à la programmation (en Java),coursera,beginner
/course/bienestar-equidad-derechos-humanos-8487,"Bienestar, equidad y derechos humanos",coursera,beginner
/course/uva-darden-design-thinking-innovation-ar-13139,صياغة الأفكار المحفِّزة على الابتكار,coursera,beginner
/course/uva-darden-customer-centric-it-strategy-es-39515,Estrategia de IT centrada en el cliente,coursera,beginner
/course/uva-darden-digital-product-management-es-40272,Gestión de productos digitales: Fundamentos modernos,coursera,beginner
/course/uva-darden-foundations-business-strategy-ru-45897,Основы бизнес-стратегии,coursera,beginner
/course/uva-darden-project-management-fr-40271,Bases de la planification et de la gestion de projet,coursera,beginner
/course/uva-darden-project-management-de-40270,Grundlagen zum Thema Projektplanung und -management,coursera,beginner
/course/uva-darden-digital-product-management-pt-33575,Gestão de produtos digitais: Princípios básicos modernos,coursera,beginner
/course/uva-darden-design-thinking-innovation-pt-33578,Design Thinking para Inovação,coursera,beginner
/course/uva-darden-foundations-business-strategy-de-39454,Grundlagen der Geschäftsstrategie,coursera,beginner
/course/sql-for-data-science-de-65147,SQL für Data Science,coursera,beginner
/course/learn-chinese-mandarin-11931,Learning Chinese : Start From Scratch (零到一學中文),coursera,beginner
/course/zhuangzi-6984,"莊子─姿勢、意識與感情 (Zhuangzi─Posture, Awareness, and Sentiment)",coursera,beginner
/course/shaonian-fuli-4838,少年福利與權利 (Welfare and Rights of Youth),coursera,beginner
/course/ntuugp-1604,活用希臘哲學 (Understanding the Greek Philosophy),coursera,beginner
/course/kunqu-652,崑曲之美,coursera,beginner
/course/finance-for-non-finance-de-37588,Finanzen für Nicht-Finanzfachleute,coursera,beginner
/course/acuerdos-globales-9631,Acuerdos globales para el desarrollo sostenible,coursera,beginner
/course/democracia-2083,Democracia y decisiones públicas. Introducción al análisis de políticas públicas,coursera,beginner
/course/representaciones-culturales-1969,Representaciones culturales de las sexualidades,coursera,beginner
/course/actua-dolor-cronico-12048,Actúa ante el dolor crónico,coursera,beginner
/course/introduccion-al-calculo-4225,Pre-Calculus,coursera,beginner
/course/yoga-8829,大学生瑜伽,coursera,beginner
/course/genetic-lab-4796,遗传学实验,coursera,beginner
/course/bjmuepiabc-2355,流行病学基础（上）,coursera,beginner
/course/como-persuadir-8062,"¿Cómo persuadir? Jugando con palabras, imágenes y números",coursera,beginner
/course/fundamentals-of-graphic-design-ru-33466,Основы графического дизайна,coursera,beginner
/course/fundamentals-of-graphic-design-fr-33465,Fondamentaux de l’infographie,coursera,beginner
/course/fundamentals-of-graphic-design-de-33467,Grundlagen des Grafikdesigns,coursera,beginner
/course/recherche-documentaire-6506,La recherche documentaire,coursera,beginner
/course/finanzas-empresariales-4633,Fundamentos de Finanzas Empresariales ,coursera,beginner
/course/finanzen-7794,Das liebe Geld - Finance im Alltag,coursera,beginner
/course/resilience-uncertainty-19363,Resilience Skills in a Time of Uncertainty,coursera,beginner
/course/programmation-56642,Introduction à la programmation,coursera,beginner
/course/archeology-22247,A l’avènement du christianisme : l’archéologie des derniers païens,coursera,beginner
/course/langues-diversite-92873,Langues et diversité: de la variation au plurilinguisme,coursera,beginner
/course/matlab-ko-62882,MATLAB을 사용한 프로그래밍 소개,coursera,beginner
/course/teamwork-skills-effective-communication-ar-36430,مهارات العمل الجماعي: التواصل الفعّال في مجموعات,coursera,beginner
/course/aprendiendo-a-aprender-ie-19039,Aprendiendo a Aprender,coursera,beginner
/course/posicionamiento-6822,Posicionamiento: La base del éxito en la estrategia de marketing,coursera,beginner
/course/plan-de-marketing-6821,El plan de marketing,coursera,beginner
/course/comercio-inmigracion-tipos-de-cambio-12290," Comercio, Inmigración y Tipos de Cambio en un Mundo Globalizado",coursera,beginner
/course/capstone-estrategia-6820,Proyecto capstone estrategia de marketing,coursera,beginner
/course/sig-1-8801,Systèmes d’Information Géographique - Partie 1,coursera,beginner
/course/sig-2-8802,Systèmes d’Information Géographique - Partie 2,coursera,beginner
/course/enseignes-et-afficheurs-led-9206,Enseignes et afficheurs à LED,coursera,beginner
/course/planification-mobilites-11105,Planification des mobilités,coursera,beginner
/course/desarrollo-musicalidad-4770,Desarrollando tu musicalidad,coursera,beginner
/course/desenvolvendo-musicalidade-9459,Desenvolvendo sua musicalidade,coursera,beginner
/course/composicao-escrevendo-letra-9457,Composição: Escrevendo a letra,coursera,beginner
/course/blockchain-espanol-10495,La Disrupción del Blockchain,coursera,beginner
/course/exito-profesional-18718,Éxito Profesional,coursera,beginner
/course/smart-working-lavoro-agile-business-english-40300,Smart Working: Lavoro agile e Business English,coursera,beginner
/course/introduzione-data-visualization-tableau-40316,Introduzione alla Data Visualization con Tableau,coursera,beginner
/course/fondamentaux-negociation-11052,Les Fondamentaux de la Négociation ,coursera,beginner
/course/entrepreneuriatquichangelemonde-6202,L'entrepreneuriat social : de l'envie au projet,coursera,beginner
/course/leadership-excellence-sport-15236,Leadership d'excellence par le sport de haut niveau,coursera,beginner
/course/raison-etre-et-entreprise-a-mission-19244,Raison d’être et Entreprise à Mission,coursera,beginner
/course/evaluation-mesure-impact-social-13118,Évaluation & Mesure d'Impact Social,coursera,beginner
/course/les-alliances-qui-changent-les-territoir-7049,"Les alliances qui changent les territoires : partenariats entre acteurs publics, acteurs privés et structures d'intérêt général pour le bien commun",coursera,beginner
/course/innovation-publique-pensee-design-8686,"Innovation publique et pensée design, l'innovation sociale au service des territoires",coursera,beginner
/course/gerer-les-crises-de-demain-85203,Gérer les crises de demain,coursera,beginner
/course/diversite-inclusion-travail-66424,Diversité et inclusion sur le lieu de travail ,coursera,beginner
/course/belles-histoires-d-entreprises-a-impact-37081,Belles histoires d'entreprises à impact,coursera,beginner
/course/nouveaux-modeles-economiques-association-16855,Nouveaux modèles économiques des associations,coursera,beginner
/course/emprender-6034,Emprender la emprendeduría,coursera,beginner
/course/gestion-personas-equipos-8136,La gestión de personas y equipos,coursera,beginner
/course/tang-poems-6850,唐詩新思路 (Tang Poetry),coursera,beginner
/course/the-red-chamber-dream-daguan-garden-33431,又見大觀：《紅樓夢》中的烏托邦 (The Red Chamber Dream (3): Daguan Garden),coursera,beginner
/course/inquiry-into-confucius-and-mencius-33432,深扣孔孟 (An Inquiry into Confucius and Mencius),coursera,beginner
/course/agribusiness-management-56517,農企業管理學 (Agribusiness Management),coursera,beginner
/course/marketing-stp-crm-7804,行銷典範轉移: 變動中的消費世界 (Marketing in a changing world),coursera,beginner
/course/robotics1-8553,機器人學一 (Robotics (1)),coursera,beginner
/course/lung-cancer-9971, 一堂課讓你認識肺癌（Basic Concepts of Lung Cancer: Diagnosis and Treatment）,coursera,beginner
/course/zhuangzi-renqing-12169,莊子─人情 (Zhuangzi─Between People),coursera,beginner
/course/gabr-9300,商管研究中的賽局分析（一）：通路選擇、合約制定與共享經濟 (Game Theoretic Analysis for Business Research (1)),coursera,beginner
/course/poetry-prose-novel-12657,現代文學導讀：詩、散文、小說,coursera,beginner
/course/game-theory-and-business-strategy-10743,賽局與產業競爭策略 (Game Theory and Business Strategy),coursera,beginner
/course/origensdavida-2579,Origens da Vida no Contexto Cósmico,coursera,beginner
/course/alta-direccion-4552,¿Qué hacen los buenos directivos? Prioridades de la Alta Dirección,coursera,beginner
/course/espace-mondial-fr-4839,"Espace mondial, une vision française des global studies",coursera,beginner
/course/autoridad-7144,"Autoridad, dirección y liderazgo",coursera,beginner
/course/wasser-schweiz-9583,Wasser in der Schweiz,coursera,beginner
/course/gestiondeltalento-7145,Gestión del talento humano,coursera,beginner
/course/america-latina-5909,América Latina en los cambios internacionales: amenazas y oportunidades. ,coursera,beginner
/course/alfabetizacao-midiatica-20860,"Alfabetização Midiática, Informacional e Diálogo Intercultural - UNESCO e UNICAMP",coursera,beginner
/course/aprogramar-2939,¡A Programar! Una introducción a la programación,coursera,beginner
/course/neurociencia-21497,Introducción a la Neurociencia,coursera,beginner
/course/fundamentos-de-la-gestion-de-proyectos-61442,Fundamentos de la gestión de proyectos,coursera,beginner
/course/cash-flow-statement-89824,قائمة التدفقات النقدية | Cash Flow Statement,coursera,beginner
/course/estadistica-probabilidad-13773,Estadística y probabilidad,coursera,beginner
/course/riesgos-fenomenos-naturales-9520,Evaluación de peligros y riesgos por fenómenos naturales,coursera,beginner
/course/geotermia-9053,Introducción a la geotermia,coursera,beginner
/course/soluciondeproblemas-7132,Solución de problemas y toma de decisiones,coursera,beginner
/course/evaluacion-educativa-12270,Evaluación del y para el aprendizaje en educación universitaria,coursera,beginner
/course/innovacion-agro-7011,Innovación agroalimentaria ,coursera,beginner
/course/seguridad-hidrica-19217,Seguridad hídrica,coursera,beginner
/course/genero-igualdad-66046,Conceptos básicos para la igualdad de género,coursera,beginner
/course/sesenta-anos-inteligencia-artificial-12427,Sesenta años de inteligencia artificial,coursera,beginner
/course/control-automatico-9258,Control automático: La tecnología invisible ,coursera,beginner
/course/tratamiento-caries-12761,Manejo moderno de la caries dental,coursera,beginner
/course/como-autoconstruir-tu-vivienda-segunda-e-12387,Cómo autoconstruir tu vivienda. Segunda etapa,coursera,beginner
/course/hgproyectofinal-7139,Habilidades gerenciales: Proyecto final,coursera,beginner
/course/enlinea-21330,Cursos en línea: modelo para armar,coursera,beginner
/course/quimica-etica-13219,"Química, guerra y ética",coursera,beginner
/course/modelos-negocios-16959,Nuevos modelos de negocios en el siglo XXI,coursera,beginner
/course/designthinking-docencia-96160,Innovar tu enseñanza con design thinking,coursera,beginner
/course/residente-22138,El rol docente del médico residente,coursera,beginner
/course/funciones-algebraicas-19727,Funciones algebraicas y trascendentes ,coursera,beginner
/course/liderazgo-innovacion-59539,Liderazgo e innovación,coursera,beginner
/course/estrategias-digitales-innovacion-ciudades-hidroin-59540,Estrategias para la innovación: Ciudades hidro-inteligentes,coursera,beginner
/course/hd-92925,Introducción a las humanidades digitales,coursera,beginner
/course/credito-32118,Crédito y cobranza,coursera,beginner
/course/quimica-alimentos-41075,La química en la producción de alimentos y medicamentos,coursera,beginner
/course/resolucion-busqueda-12453,Resolución de problemas por búsqueda,coursera,beginner
/course/innovacion-medios-digitales-59523,Innovación y medios digitales en proyectos sociales,coursera,beginner
/course/violencia-genero-114656,Violencias por razones de género,coursera,beginner
/course/antibioticos-59399,"Antibióticos ¿cuándo, cómo y para qué?",coursera,beginner
/course/intro-redes-sociales-4626,Introducción a las redes sociales. Sus objetivos y métricas. ,coursera,beginner
/course/proyect-13269,Proyecto de diseño instruccional para el aprendizaje activo en ambientes digitales,coursera,beginner
/course/analticas-de-datos-con-pandas-60130,Analíticas de Datos con Pandas,coursera,beginner
/course/disenando-estrategia-negocio-america-latina-16926,Diseñando una estrategia de negocios en América Latina,coursera,beginner
/course/el-liderazgo-del-director-de-proyectos-43542,El liderazgo del director de proyectos,coursera,beginner
/course/desarrollo-marca-personal-94511,Desarrollo de tu marca personal,coursera,beginner
/course/atencion-paciente-90264,Atención centrada en el paciente,coursera,beginner
/course/como-funcionan-las-marcas-94515,¿Cómo funcionan las marcas?,coursera,beginner
/course/planificacion-marketing-digital-first-course-1-96575,¿Qué hacer con tu estrategia digital en tiempos de cambio?,coursera,beginner
/course/inteligencia-artificial-centrada-en-el-ser-humano-41102,Inteligencia Artificial centrada en el ser humano,coursera,beginner
/course/competencias-en-telesalud-para-el-profesional-de--35789,Competencias en Telesalud para el profesional de la salud,coursera,beginner
/course/impulsando-la-transformacin-del-marketing-digital-96573, Impulsando la transformación del marketing digital,coursera,beginner
/course/calidad-en-la-atn-clnica-90263,Calidad en la atención clínica,coursera,beginner
/course/implicaciones-estratgicas-de-la-marca-94516,Implicaciones estratégicas de la marca,coursera,beginner
/course/tecnologa-como-facilitador-en-soluciones-de-telem-92034,Tecnología como facilitador en soluciones de Telemedicina,coursera,beginner
/course/exploracin-centrada-en-el-paciente-92035,Exploración centrada en el paciente,coursera,beginner
/course/proceso-gestion-marca-estrategico-94512,Proceso de gestión de marca estratégico,coursera,beginner
/course/conformando-tu-estrategia-digital-96576,Conformando tu estrategia digital,coursera,beginner
/course/asp-conceptuales-operativos-telesalud-92036,Aspectos conceptuales y operativos de la Telesalud,coursera,beginner
/course/prcticas-interprofesionales-para-la-atencin-clnic-90270,Prácticas interprofesionales para la atención clínica,coursera,beginner
/course/hablar-bien-en-publico-10518,Cómo hablar bien en público,coursera,beginner
/course/competencias-digitales-access-13589,Competencias digitales de ofimática: Microsoft Access,coursera,beginner
/course/humanidades-digitales-12353,Humanidades digitales,coursera,beginner
/course/competencias-digitales-herramientas-basi-13591,Competencias digitales. Conceptos y herramientas básicas,coursera,beginner
/course/competencias-digitales-ofimatica-excel-59500,Competencias digitales de ofimática: Microsoft Excel,coursera,beginner
/course/patrocinio-deportivo-5814,Patrocinio Deportivo,coursera,beginner
/course/iniciacion-jeroglificos-egipcios-12580,Iniciación a los jeroglíficos egipcios,coursera,beginner
/course/ciudades-politicas-urbanas-10444,Ciudades en crisis y nuevas políticas urbanas,coursera,beginner
/course/anticonconcepcion-hormonal-12362,Anticoncepción hormonal al alcance de todos,coursera,beginner
/course/formacion-pensamiento-critico-40301,La formación del pensamiento crítico en la era digital,coursera,beginner
/course/finanzas-basicas-8347,Kit básico (para evitar los errores más frecuentes) de finanzas,coursera,beginner
/course/ue-historia-instituciones-politicas-22662,"Unión Europea: Historia, Instituciones y Políticas",coursera,beginner
/course/competencias-digitales-ofimatica-word-59501,Competencias digitales de ofimática: Microsoft Word,coursera,beginner
/course/proteccion-datos-37633,Ley de protección de datos. Conoce tus derechos,coursera,beginner
/course/accion-comunitaria-110347,Acción Comunitaria. Enfoques para la transformación social,coursera,beginner
/course/physique-2-infinis-infiniment-grand-12528,Vers l'infiniment grand - Voyages de l'infiniment grand à l'infiniment petit,coursera,beginner
/course/physique-2-infinis-et-nous-10674,Les deux infinis et nous - Voyages de l'infiniment grand à l'infiniment petit,coursera,beginner
/course/physique-2-infinis-liens-12182,D'un infini à l'autre - Voyages de l'infiniment grand à l'infiniment petit,coursera,beginner
/course/architettura-contemporanea-11230,Introduzione alla Storia dell'Architettura Contemporanea,coursera,beginner
/course/tesoros-de-la-fisica-4646,Tesoros de la Física y sus Descubridores I,coursera,beginner
/course/escoger-carrera-y-universidad-12013,PlanU: escoge la mejor carrera y universidad para ti,coursera,beginner
/course/objetivos-desarrollo-sostenible-19249,Objetivos de desarrollo sostenible para América Latina y el Caribe,coursera,beginner
/course/derechos-humanos-democracia-america-latina-21634,DDHH y democracia: una visión desde América Latina,coursera,beginner
/course/aprendizaje-matematicas-primaria-13414,Aprendizaje de las matemáticas de primaria,coursera,beginner
/course/desarrollo-videojuegos-unity-4665,Desarrollo de Videojuegos en Unity: Una Introducción,coursera,beginner
/course/como-financiar-mi-empresa-5531,¿Cómo financiar mi empresa?,coursera,beginner
/course/negocios-multinacionales-america-latina-16848,Hacer negocios con multinacionales y empresas en América Latina,coursera,beginner
/course/diseno-videojuegos-intro-4598,Diseño de Videojuegos: Una introducción,coursera,beginner
/course/ensenanza-matematicas-primaria-17290,Enseñanza de las matemáticas de primaria,coursera,beginner
/course/objetivos-desarrollo-sostenible-empresas-21077,Los Objetivos de Desarrollo Sostenible para las empresas,coursera,beginner
/course/principios-y-regulaciones-de-seguridad-de-la-info-58193,Principios y Regulaciones de Seguridad de la Información,coursera,beginner
/course/uml-21107,Introducción a UML,coursera,beginner
/course/programacion-python-32745,Programación en Python,coursera,beginner
/course/ods-y-sostenibilidad-una-mirada-desde-los-colegio-70665,ODS y sostenibilidad: una mirada desde los colegios,coursera,beginner
/course/arquitecturas-de-big-data-58187,Arquitecturas de Big Data ,coursera,beginner
/course/herramientas-de-la-economa-circular-24355,Herramientas de la Economía Circular,coursera,beginner
/course/integracion-y-preparacion-de-datos-58205,Integración y preparación de datos,coursera,beginner
/course/analitica-procesos-optimizacion-desde-datos-56489,Analítica de Procesos: Optimización desde los Datos,coursera,beginner
/course/videojuegos-emprendimiento-4605,Emprendimiento y métodos ágiles de desarrollo en videojuegos,coursera,beginner
/course/introduccion-ciencia-de-datos-aplicada-58207,Introducción a la ciencia de datos aplicada,coursera,beginner
/course/proyectos-complejos-exitosos-fracasados-19618,Proyectos complejos: éxitos o fracasos,coursera,beginner
/course/modelaje-anlisis-informacin-georreferenciada-58203,Modelaje y Análisis con información georreferenciada,coursera,beginner
/course/analytics-analisis-datos-40821,Analytics en las organizaciones,coursera,beginner
/course/seguridad-en-la-red-58198,Seguridad en la red,coursera,beginner
/course/salud-mental-y-atencion-comunitaria-96582,Salud mental y atención comunitaria,coursera,beginner
/course/vulnerabilidades-y-pruebas-de-penetracion-58195,Vulnerabilidades y pruebas de penetración,coursera,beginner
/course/videojuegos-3d-unity-4644,Desarrollo de Videojuegos 3D en Unity: Una Introducción,coursera,beginner
/course/salud-mental-y-atencion-psicosocial-96583,Salud mental y atención psicosocial ,coursera,beginner
/course/datos-no-tradicionales-en-repositorios-nosql-58202,Datos no tradicionales en repositorios NoSQL,coursera,beginner
/course/educacion-matematica-para-profesores-de-infantil--98825,Educación Matemática para profesores de infantil. Curso 1,coursera,beginner
/course/analisis-sistemas-electricos-y-transicion-energet-108440,Análisis de Sistemas Eléctricos y Transición Energética,coursera,beginner
/course/modelos-predictivos-con-aprendizaje-automatico-58190,Modelos predictivos con aprendizaje automático,coursera,beginner
/course/pensamiento-sistemico-en-el-siglo-xxi-110387,Pensamiento Sistémico en el Siglo XXI,coursera,beginner
/course/introduccion-a-la-inteligencia-artificial-contemp-108438,Introducción a la inteligencia artificial contemporánea,coursera,beginner
/course/educacion-matematica-para-profesores-de-infantil--98826,Educación Matemática para profesores de infantil. Curso 2,coursera,beginner
/course/discrete-mathematics-ch-8275,离散数学,coursera,beginner
/course/rebo-binario-22275,Rebo-binario,coursera,beginner
/course/marketing-digital-pilares-7086,Pilares de Marketing Digital,coursera,beginner
/course/redes-sociales-estrategias-7085,Estrategias de  Redes Sociales,coursera,beginner
/course/negociacion-iae-11560,Negociación 4.0,coursera,beginner
/course/disenando-paginas-bootstrap4-12411,Diseñando páginas web con Bootstrap 4,coursera,beginner
/course/conceptos-estudio-del-medio-ambiente-11769,Conceptos base para el estudio del medio ambiente,coursera,beginner
/course/finanzas-corporativas-17318,Finanzas Corporativas,coursera,beginner
/course/programacion-python-objetos-13656,Programación Orientada a Objetos con Python,coursera,beginner
/course/educacion-contextos-rurales-america-lati-11768,Educación en Contextos Rurales: Perspectivas en América Latina,coursera,beginner
/course/desarrollar-paginas-web-con-angular-12880,Desarrollo de páginas con Angular,coursera,beginner
/course/modelizacion-cuantitativa-para-finanzas-corporati-33525,Modelización Cuantitativa para Finanzas Corporativas,coursera,beginner
/course/metodologia-scrum-27992,Modalidades organizacionales ágiles en base a la Metodología Scrum,coursera,beginner
/course/alfabetizacion-temprana-contextos-rurales-18057,La alfabetización temprana en contextos rurales ,coursera,beginner
/course/ensenar-aprender-evaluar-escuelas-rurale-11979,"Enseñar, aprender y evaluar en Escuelas Rurales",coursera,beginner
/course/marketing-digital-proyecto-final-7089,Proyecto Final - Programa Especializado en Marketing Digital,coursera,beginner
/course/inversiones-en-cripto-61328,Cómo Invertir en Cripto,coursera,beginner
/course/matematica-aulas-heterogeneas-16990,Jugar y Aprender Matemática en aulas heterogéneas,coursera,beginner
/course/competencias-empleabilidad-linkyou-19404,Competencias para la empleabilidad,coursera,beginner
/course/emprendiendo-en-stem-15150,Emprendiendo en STEM,coursera,beginner
/course/educacion-ambiental-para-la-biodiversidad-24314,Educación ambiental para la biodiversidad,coursera,beginner
/course/trabajo-proyectos-escuelas-rurales-18099,El trabajo por proyectos en escuelas de contextos rurales,coursera,beginner
/course/gestion-estrategica-escuelas-rurales-11977,Gestión estratégica de Escuelas en Contextos Rurales,coursera,beginner
/course/nlp-modelos-y-algoritmos-61634,NLP Modelos y Algoritmos,coursera,beginner
/course/introduccion-al-procesamiento-de-lenguaje-natural-27204,Introducción al procesamiento de lenguaje natural,coursera,beginner
/course/limpieza-de-datos-para-el-procesamiento-de-lengua-46001,Limpieza de datos para el procesamiento de lenguaje natural,coursera,beginner
/course/nlp-system-architecture-and-dev-ops-89909,NLP System Architecture and Dev-Ops,coursera,beginner
/course/excel-essentials-ar-13198,مهارات برنامج Excel للعمل: المبادئ الأساسية,coursera,beginner
/course/excel-essentials-de-33501,Excel-Kenntnisse für Unternehmen: Grundlagen,coursera,beginner
/course/foundx-beta-course-21794,FoundX Startup School Course,coursera,beginner
/course/applying-to-college-7504,How to Apply to College,coursera,beginner
/course/criacao-startups-8546,Criação de Startups: Como desenvolver negócios inovadores,coursera,beginner
/course/mapas-conceituais-10717,Mapas conceituais para aprender e colaborar,coursera,beginner
/course/contabilidad-financiera-97466,Introducción a la Contabilidad Financiera,coursera,beginner
/course/finanzas-operativas-12315,Finanzas para directivos,coursera,beginner
/course/analisis-situaciones-negocio-12318,Análisis de situaciones de negocio,coursera,beginner
/course/migrations-internationales-10323,Migrations internationales : un enjeu mondial,coursera,beginner
/course/grand-paris-metropole-11071,A la recherche du Grand Paris,coursera,beginner
/course/grand-paris-metropolis-11069,Searching for the Grand Paris,coursera,beginner
/course/aspectos-basicos-datos-datos-en-todas-partes-61469,"Aspectos básicos: Datos, datos, en todas partes",coursera,beginner
/course/sustentabilidad-economias-sociales-8315,Sustentabilidad y Economías Sociales,coursera,beginner
/course/potenciando-aprendizaje-8368,Potenciando mi aprendizaje en el primer año de Universidad,coursera,beginner
/course/problem-solving-skills-ar-39516,مهارات حل المسائل لتحقيق النجاح في الجامعة,coursera,beginner
/course/explorando-energia-sustentable-9052,Explorando la Energía Sustentable,coursera,beginner
/course/communication-skills-ar-39523,مهارات التواصل لتحقيق النجاح في الجامعة,coursera,beginner
/course/digital-literacy-ar-39521,محو الأمية المعلوماتية والرقمية لتحقيق النجاح في الجامعة,coursera,beginner
/course/critical-thinking-skills-ar-39522,مهارات التفكير النقدي لتحقيق النجاح في الجامعة,coursera,beginner
/course/planificacion-gestion-pymes-21108,Planificación y gestión estratégica para Pymes,coursera,beginner
/course/aspectos-basicos-del-diseno-de-la-experiencia-del-61459,Aspectos básicos del diseño de la experiencia del usuario,coursera,beginner
/course/szemleletvaltas-98965,Szemléletváltás,coursera,beginner
