Link,Title,Platform,Level
/course/medical-research-19515,Understanding Medical Research: Your Facebook Friend is Wrong,coursera,beginner
/course/dmdigitalworld-2750,Marketing in a Digital World,coursera,beginner
/course/protect-business-innovations-patent-10382,Protecting Business Innovations via Patent,coursera,beginner
/course/vector-calculus-engineers-17387,Vector Calculus for Engineers,coursera,beginner
/course/information-systems-audit-17979,"Information Systems Auditing, Controls and Assurance",coursera,beginner
/course/fintech-11193,FinTech Foundations and Overview,coursera,beginner
/course/mindshift-8289,Mindshift: Break Through Obstacles to Learning and Discover Your Hidden Potential,coursera,beginner
/course/uncommon-sense-teaching-46410,Uncommon Sense Teaching,coursera,beginner
/course/modpo-356,Modern & Contemporary American Poetry (“ModPo”),coursera,beginner
/course/digital-marketing-revolution-54370,The Digital Marketing Revolution,coursera,beginner
/course/python-18625,Python for Everybody,coursera,beginner
/course/learning-how-to-learn-youth-12569,Learning How To Learn for Youth,coursera,beginner
/course/differential-equations-engineers-13258,Differential Equations for Engineers,coursera,beginner
/course/matrix-algebra-engineers-11986,Matrix Algebra for Engineers,coursera,beginner
/course/fibonacci-6684,Fibonacci Numbers and the Golden Ratio,coursera,beginner
/course/matlab-3396,Introduction to Programming with MATLAB,coursera,beginner
/course/learning-how-to-learn-2161,Learning How to Learn: Powerful mental tools to help you master tough subjects,coursera,beginner
/course/learn-korean-5730,First Step Korean,coursera,beginner
/course/dino101-1057,Dino 101: Dinosaur Paleobiology,coursera,beginner
/course/machine-learning-835,Machine Learning,coursera,beginner
/course/scigast-519,The Science of Gastronomy,coursera,beginner
/course/programming1-385,Learn to Program: The Fundamentals,coursera,beginner
/course/apprendre-comment-apprendre-18067,Apprendre comment apprendre (ACA) : Des outils mentaux puissants qui vous aideront à maîtriser des sujets difficiles,coursera,beginner
/course/computational-social-science-methods-17299,Computational Social Science Methods,coursera,beginner
/course/computational-social-science-ucdavis-18710,Computational Social Science,coursera,beginner
/course/humanlanguage-2940,Miracles of Human Language: An Introduction to Linguistics,coursera,beginner
/course/regtech-11726,FinTech Security and Regulation (RegTech),coursera,beginner
/course/mindfulness-6951,De-Mystifying Mindfulness,coursera,beginner
/course/fintech-risk-management-12007,FinTech Risk Management,coursera,beginner
/course/intro-indoor-air-quality-9706,Introduction to Indoor Air Quality,coursera,beginner
/course/socialpsychology-555,Social Psychology,coursera,beginner
/course/green-business-strategy-12644,Green Business Strategy,coursera,beginner
/course/health-concepts-chinese-medicine-9496,Health Concepts in Chinese Medicine,coursera,beginner
/course/protect-business-innovations-copyright-8733,Protecting Business Innovations via Copyright,coursera,beginner
/course/food-and-health-5057,Stanford Introduction to Food and Health,coursera,beginner
/course/interactivepython2-3196,An Introduction to Interactive Programming in Python (Part 2),coursera,beginner
/course/philosophy-science-religion-3-10623,"Philosophy, Science and Religion: Religion and Science",coursera,beginner
/course/strategy-law-ethics-6195,"Making Successful Decisions through the Strategy, Law & Ethics Model",coursera,beginner
/course/accounting-business-society-12434,"Accounting, Business and Society:  The Multi-faceted Role of Accounting",coursera,beginner
/course/protect-business-innovations-trademark-10038,Protecting Business Innovations via Trademark,coursera,beginner
/course/childnutrition-816,Child Nutrition and Cooking,coursera,beginner
/course/product-management-essentials-46400,Product Management Essentials,coursera,beginner
/course/financialmarkets-912,Financial Markets,coursera,beginner
/course/dmanalyticstheory-2753,Digital Marketing Analytics in Theory,coursera,beginner
/course/gte-sustainable-cities-4851,Greening the Economy: Sustainable Cities,coursera,beginner
/course/einstein-765,Understanding Einstein: The Special Theory of Relativity,coursera,beginner
/course/exploratory-data-analysis-matlab-17125,Exploratory Data Analysis with MATLAB,coursera,beginner
/course/social-innovation-6655,Becoming a changemaker: Introduction to Social Innovation,coursera,beginner
/course/db-303,Introduction to Databases,coursera,beginner
/course/criticalmanagement-714,Critical Perspectives on Management,coursera,beginner
/course/data-science-crash-course-4392,A Crash Course in Data Science,coursera,beginner
/course/sciwrite-464,Writing in the Sciences,coursera,beginner
/course/projects101-3292,Fundamentals of Project Planning and Management,coursera,beginner
/course/julia-programming-7092,Julia Scientific Programming,coursera,beginner
/course/dmanalyticspractice-2754,Digital Marketing Analytics in Practice,coursera,beginner
/course/design-371,Design: Creation of Artifacts in Society,coursera,beginner
/course/computer-simulations-17986,Computer Simulations,coursera,beginner
/course/songwriting-lyrics-523,Songwriting: Writing the Lyrics,coursera,beginner
/course/philosophy-science-religion-2-9085,"Philosophy, Science and Religion: Philosophy and Religion",coursera,beginner
/course/terrorism-701,Terrorism and Counterterrorism: Comparing Theory and Practice,coursera,beginner
/course/fundamentals-of-graphic-design-4792,Fundamentals of Graphic Design,coursera,beginner
/course/strategy101-546,Foundations of Business Strategy,coursera,beginner
/course/game-theory-1-308,Game Theory,coursera,beginner
/course/astro-3007,Astronomy: Exploring Time and Space,coursera,beginner
/course/tricky-american-english-pronunciation-8274,Tricky American English Pronunciation,coursera,beginner
/course/wgs-bacteria-8907,Whole genome sequencing of bacterial genomes - tools and applications,coursera,beginner
/course/protect-business-innovations-strategy-10496,Protecting Business Innovations via Strategy,coursera,beginner
/course/stem-6538,"English for Science, Technology, Engineering, and Mathematics",coursera,beginner
/course/wharton-communication-skills-8235,Improving Communication Skills,coursera,beginner
/course/brainspace-1362,The Brain and Space,coursera,beginner
/course/java-programming-4305,Java Programming: Solving Problems with Software,coursera,beginner
/course/know-thyself-the-examined-life-432, Know Thyself - The Value and Limits of Self-Knowledge: The Examined Life,coursera,beginner
/course/establishing-product-market-fit-46413,Establishing Product-Market Fit,coursera,beginner
/course/dentmedpenn-2902,Introduction to Dental Medicine,coursera,beginner
/course/public-speaking-889,Introduction to Public Speaking,coursera,beginner
/course/stanford-statistics-33479,Introduction to Statistics,coursera,beginner
/course/3d-printing-software-5993,3D Printing Software,coursera,beginner
/course/datasciencemathskills-7745,Data Science Math Skills,coursera,beginner
/course/duke-programming-web-4256,"Programming Foundations with JavaScript, HTML and CSS",coursera,beginner
/course/bigbang-722,From the Big Bang to Dark Energy,coursera,beginner
/course/business-6010,English for Business and Entrepreneurship,coursera,beginner
/course/challengesgh-2376,The Challenges of Global Health,coursera,beginner
/course/understanding-arguments-6620,Think Again I: How to Understand Arguments,coursera,beginner
/course/welcomegametheory-2883,Welcome to Game Theory,coursera,beginner
/course/developing-innovative-ideas-for-product-leaders-46401,Developing Innovative Ideas for Product Leaders,coursera,beginner
/course/constitution-2082,Introduction to Key Constitutional Concepts and Supreme Court Cases,coursera,beginner
/course/magicmiddleages-3477,Magic in the Middle Ages,coursera,beginner
/course/success-8087,The Science of Success: What Researchers Know that You Should Know,coursera,beginner
/course/manage-health-covid-19-19289,Mind Control: Managing Your Mental Health During COVID-19,coursera,beginner
/course/intro-game-design-4220,Introduction to Game Design,coursera,beginner
/course/film-images-542,"Film, Images & Historical Interpretation in the 20th Century: The Camera Never Lies",coursera,beginner
/course/security-safety-globalized-world-7770,Security & Safety Challenges in a Globalized World,coursera,beginner
/course/mindware-8128,Mindware: Critical Thinking for the Information Age ,coursera,beginner
/course/americanlaw-2872,An Introduction to American Law,coursera,beginner
/course/organizational-analysis-459,Organizational Analysis ,coursera,beginner
/course/chem991-2375,Introduction to Chemistry:  Reactions and Ratios,coursera,beginner
/course/cancer-metastasis-7624,Understanding Cancer Metastasis,coursera,beginner
/course/chemhealth-2053,Chemicals and Health,coursera,beginner
/course/modern-world-430,"The Modern World, Part One: Global History from 1760 to 1910",coursera,beginner
/course/sleep-3233,"Sleep: Neurobiology, Medicine, and Society",coursera,beginner
/course/typography-5444,Introduction to Typography,coursera,beginner
/course/compneuro-449,Computational Neuroscience,coursera,beginner
/course/neurobio-1606,Understanding the Brain: The Neurobiology of Everyday Life,coursera,beginner
/course/musictheory-1358,Fundamentals of Music Theory,coursera,beginner
/course/financial-management-for-product-leaders-46405,Financial Management for Product Leaders,coursera,beginner
/course/finance-healthcare-managers-10797,Financial Acumen for Non-Financial Managers,coursera,beginner
/course/intellectual-humility-science-7657,Intellectual Humility: Science,coursera,beginner
/course/disasterprep-481,Disaster Preparedness,coursera,beginner
/course/personalfinance-3965,Financial Planning for Young Adults,coursera,beginner
/course/data-public-health-8921,Data and Health Indicators in Public Health Practice,coursera,beginner
/course/understanding-visualization-data-12647,Understanding and Visualizing Data with Python,coursera,beginner
/course/michigan-sport-related-concussion-traini-15223,Michigan Sport-Related Concussion Training Certification ,coursera,beginner
/course/positive-psychology-visionary-science-8337,Positive Psychology: Martin E. P. Seligman’s Visionary Science,coursera,beginner
/course/java-programming-arrays-lists-data-4362,"Java Programming: Arrays, Lists, and Structured Data",coursera,beginner
/course/addictedbrain-1403,The Addicted Brain,coursera,beginner
/course/gender-based-violence-3471,Confronting Gender Based Violence: Global Lessons for Healthcare Workers,coursera,beginner
/course/strategies-senior-housing-covid19-23267,Strategies for Senior Housing Communities during COVID-19,coursera,beginner
/course/writing-editing-words-19555,Writing and Editing: Word Choice and Word Order,coursera,beginner
/course/cloud-computing-2717,"Cloud Computing Concepts, Part 1",coursera,beginner
/course/construction-cost-estimating-7106,Construction Cost Estimating and Cost Control,coursera,beginner
/course/positive-psychology-methods-8335,"Positive Psychology: Character, Grit and Research Methods",coursera,beginner
/course/high-performing-teams-7121,Building High-Performing Teams,coursera,beginner
/course/do-good-feel-good-58183,The Science of Generosity: Do Good...Feel Good,coursera,beginner
/course/classdiscussion-7421,Orchestrating Whole Classroom Discussion,coursera,beginner
/course/esg-risks-opportunities-58758,ESG Risks and Opportunities,coursera,beginner
/course/career-planning--19723,"Career planning: resume/CV, cover letter, interview",coursera,beginner
/course/practical-data-science-matlab-18864,Practical Data Science with MATLAB,coursera,beginner
/course/covid-19-what-you-need-to-know-19270,COVID-19: What You Need to Know,coursera,beginner
/course/multivariate-calculus-machine-learning-10452,Mathematics for Machine Learning: Multivariate Calculus,coursera,beginner
/course/assembly-3290,Genome Sequencing (Bioinformatics II),coursera,beginner
/course/drug-discovery-654,Drug Discovery ,coursera,beginner
/course/commhealthworkers-1038,Training and Learning Programs for Volunteer Community Health Workers,coursera,beginner
/course/western-christianity-200-1650-8106,A Journey through Western Christianity: from Persecuted Faith to Global Religion (200 - 1650) ,coursera,beginner
/course/composition-617,English Composition I,coursera,beginner
/course/anatomy403-3x-12803,Anatomy: Human Neuroanatomy,coursera,beginner
/course/community-organizing-17293,Community Organizing for Social Justice ,coursera,beginner
/course/foundational-skills-communicating-health-16914,Foundational Skills for Communicating About Health,coursera,beginner
/course/crypto-finance-18184,Blockchain and Cryptocurrency Explained,coursera,beginner
/course/anatomy403-1x-12797,Anatomy: Musculoskeletal and Integumentary Systems,coursera,beginner
/course/python-basics-12555,Python Basics,coursera,beginner
/course/teamwork-skills-effective-communication-9661,Teamwork Skills: Communicating Effectively in Groups,coursera,beginner
/course/popularity-3541,Psychology of Popularity,coursera,beginner
/course/communication-strategies-virtual-age-11654,Communication Strategies for a Virtual Age,coursera,beginner
/course/black-holes-astro-101-11460,Astro 101: Black Holes,coursera,beginner
/course/health-gender-spectrum-8300,Health Across the Gender Spectrum,coursera,beginner
/course/severe-to-profound-intellectual-disabili-15206,Severe to Profound Intellectual Disability: Circles of Care and Education,coursera,beginner
/course/chemerinsky-on-constitutional-law-struct-7418,Chemerinsky on Constitutional Law - The Structure of Government,coursera,beginner
/course/wharton-managing-human-capital-6887,Managing Social and Human Capital,coursera,beginner
/course/introduction-intellectual-property-13446,Introduction to Intellectual Property,coursera,beginner
/course/finance-fundamentals-20026,Fundamentals of Finance,coursera,beginner
/course/exploring-renewable-energy-17025,Exploring Renewable Energy Schemes,coursera,beginner
/course/management-fundamentals-healthcare-admin-10801,Management Fundamentals,coursera,beginner
/course/feedingtheworld-3913,Feeding the World,coursera,beginner
/course/health-law-fundamentals-18065,U.S. Health Law Fundamentals,coursera,beginner
/course/intellectual-property-healthcare-industry-18053,Intellectual Property in the Healthcare Industry,coursera,beginner
/course/comparative-health-systems-18064,Comparative Health Systems,coursera,beginner
/course/esg-social-activism-59396,ESG and Social Activism,coursera,beginner
/course/big-data-integration-processing-6467,Big Data Integration and Processing,coursera,beginner
/course/everyday-parenting-8875,Everyday Parenting: The ABCs of Child Rearing,coursera,beginner
/course/linear-algebra-machine-learning-10453,Mathematics for Machine Learning: Linear Algebra,coursera,beginner
/course/sustainable-diets-22459,Public Health Perspectives on Sustainable Diets,coursera,beginner
/course/neuroscience-neuroimaging-9719,Fundamental Neuroscience for Neuroimaging,coursera,beginner
/course/hypothesis-testing-public-health-12760,Hypothesis Testing in Public Health ,coursera,beginner
/course/summary-statistics-12762,Summary Statistics in Public Health ,coursera,beginner
/course/simple-regression-analysis-public-health-12763,Simple Regression Analysis in Public Health ,coursera,beginner
/course/multiple-regression-analysis-public-heal-12765,Multiple Regression Analysis in Public Health ,coursera,beginner
/course/health-equity-research-17892,Foundations of Health Equity Research,coursera,beginner
/course/strategies-assisted-living-covid19-23187,Strategies for Assisted Living Communities during COVID-19,coursera,beginner
/course/big-data-ai-ethics-17300,"Big Data, Artificial Intelligence, and Ethics",coursera,beginner
/course/hiddenmessages-3289,Finding Hidden Messages in DNA (Bioinformatics I),coursera,beginner
/course/introduction-psychology-12509,Introduction to Psychology ,coursera,beginner
/course/covid-19-contact-tracing-19669,COVID-19 Contact Tracing,coursera,beginner
/course/career-advancement-7018,Successful Career Development,coursera,beginner
/course/onehealth-20756,"Bats, Ducks, and Pandemics: An Introduction to One Health Policy",coursera,beginner
/course/human-needs-8253,The Arts and Science of Relationships: Understanding Human Needs,coursera,beginner
/course/ictinprimary-1763,ICT in Primary Education: Transforming children's learning across the curriculum,coursera,beginner
/course/breastfeeding-10633,Stanford's Short Course on Breastfeeding,coursera,beginner
/course/womens-health-human-rights-8615,International Women's Health and Human Rights,coursera,beginner
/course/emergenceoflife-1401,Emergence of Life,coursera,beginner
/course/python-functions-files-dictionaries-12553,"Python Functions, Files, and Dictionaries",coursera,beginner
/course/paytech-18185,The Future of Payment Technologies,coursera,beginner
/course/introtoux-principles-and-processes-12348,Introduction to User Experience Principles and Processes,coursera,beginner
/course/compthinking-17328,Problem Solving Using Computational Thinking,coursera,beginner
/course/anatomy403-2x-12798,"Anatomy: Cardiovascular, Respiratory and Urinary Systems",coursera,beginner
/course/people-technology-and-the-future-of-mobility-107771,"People, Technology and the Future of Mobility ",coursera,beginner
/course/anatomy403-4x-12799,"Anatomy: Gastrointestinal, Reproductive and Endocrine Systems",coursera,beginner
/course/writing-editing-structure-19554,Writing and Editing: Structure and Organization,coursera,beginner
/course/understanding-user-needs-12352,Understanding User Needs,coursera,beginner
/course/data-collection-methods-6087,"Data Collection: Online, Telephone and Face-to-face",coursera,beginner
/course/invest-tech-18186,Innovations in Investment Technology: Artificial Intelligence,coursera,beginner
/course/evaluating-designs-with-users-12357,Evaluating Designs with Users,coursera,beginner
/course/credit-tech-18187,"Raising Capital: Credit Tech, Coin Offerings, and Crowdfunding",coursera,beginner
/course/brilliant-passionate-you-22019,"Brilliant, Passionate You",coursera,beginner
/course/act-on-climate-8737,"Act on Climate: Steps to Individual, Community, and Political Action",coursera,beginner
/course/sampling-methods-6084,"Sampling People, Networks and Records",coursera,beginner
/course/history-of-racial-inequity-in-healthcare-55975,History of Racial Inequity in Healthcare,coursera,beginner
/course/industrial-internet-of-things-55788,Industrial Internet of Things (IIoT),coursera,beginner
/course/introduction-to-translational-science-71220,Introduction to Translational Science ,coursera,beginner
/course/opioid-17109,"Impacting the Opioid Crisis: Prevention, Education, and Practice for Non-Prescribing Providers",coursera,beginner
/course/speaking-and-presenting-pitches-persuasion-54627,Speaking and Presenting: Pitches and Persuasion,coursera,beginner
/course/what-is-a-socially-just-university-58994,Community Awareness: What is a Socially Just University ,coursera,beginner
/course/translating-research-to-patients-71219,Translating Research to Patients,coursera,beginner
/course/translating-research-for-humans-71221,Translating Basic Research into Research for Humans ,coursera,beginner
/course/digital-twins-55789,Digital Twins,coursera,beginner
/course/chronicpain-1769,Preventing Chronic Pain: A Human Systems Approach,coursera,beginner
/course/lead-ei-710,Inspiring Leadership through Emotional Intelligence,coursera,beginner
/course/ielts-listening-speaking-40665,IELTS Listening and Speaking Sections Skills Mastery,coursera,beginner
/course/chemerinsky-individual-rights-7798,Chemerinsky on Constitutional Law – Individual Rights and Liberties,coursera,beginner
/course/life101-48059,Life 101: Mental and Physical Self-Care,coursera,beginner
/course/tesol-speaking-6201,"Teach English Now! Second Language Listening, Speaking, and Pronunciation",coursera,beginner
/course/comparinggenomes-3291,"Comparing Genes, Proteins, and Genomes (Bioinformatics III)",coursera,beginner
/course/user-experience-design-6535,Introduction to User Experience Design ,coursera,beginner
/course/3d-printing-revolution-5991,The 3D Printing Revolution,coursera,beginner
/course/clustering-3556,Genomic Data Science and Clustering (Bioinformatics V),coursera,beginner
/course/managing-emotions-uncertainty-stress-22856,Managing Emotions in Times of Uncertainty & Stress,coursera,beginner
/course/sql-for-data-science-9725,SQL for Data Science,coursera,beginner
/course/construction-scheduling-7114,Construction Scheduling,coursera,beginner
/course/gcp-fundamentals-7784,Google Cloud Fundamentals: Core Infrastructure,coursera,beginner
/course/international-travel-8782,"International Travel Preparation, Safety, & Wellness",coursera,beginner
/course/health-systems-10756,Understanding and Strengthening Health Systems,coursera,beginner
/course/jhu-getting-started-data-viz-r-22205,Getting Started with Data Visualization in R,coursera,beginner
/course/the-data-science-of-health-informatics-12856,The Data Science of Health Informatics,coursera,beginner
/course/calculus-through-data-and-modelling-imits-derivat-27983,Calculus through Data & Modeling: Limits & Derivatives,coursera,beginner
/course/precalculus-relations-functions-21858,Precalculus: Relations and Functions,coursera,beginner
/course/introduction-digital-health-entrepreneurship-58642,Introduction to Digital Health Entrepreneurship,coursera,beginner
/course/data-what-it-is-what-can-we-do-with-it-22210,"Data – What It Is, What We Can Do With It",coursera,beginner
/course/evidence-based-toxicology-12316,Evidence-based Toxicology,coursera,beginner
/course/black-agricultural-solutions-64533,Black Agricultural Solutions to Food Apartheid: A Teach-Out,coursera,beginner
/course/design-and-conduct-clinical-trials-110351,Design and Conduct of Clinical Trials,coursera,beginner
/course/the-outcomes-and-interventions-of-health-12855,The Outcomes and Interventions of Health Informatics,coursera,beginner
/course/precalculus-periodic-functions-21859,Precalculus: Periodic Functions,coursera,beginner
/course/calculus-through-data-and-modelling-precalculus-r-27987,Calculus through Data & Modeling: Precalculus Review,coursera,beginner
/course/measurement-turning-concepts-data-22203,Measurement – Turning Concepts into Data,coursera,beginner
/course/poct-for-sti-56223,Point of Care Testing for Sexually Transmitted Infections,coursera,beginner
/course/a-public-health-approach-to-hearing-loss-and-agin-74666,A Public Health Approach to Hearing Loss and Aging,coursera,beginner
/course/precalculus-mathematical-modelling-21860,Precalculus: Mathematical Modeling,coursera,beginner
/course/clinical-trials-data-collection-management-qualit-110350,Clinical Trials Data Management and Quality Assurance,coursera,beginner
/course/tidyverse-importing-data-22820,Importing Data in the Tidyverse,coursera,beginner
/course/leadership-for-cancer-informatics-research-56965,Leadership for Cancer Informatics  Research,coursera,beginner
/course/clinical-trials-management-and-advanced-operation-110349,Clinical Trials Management and Advanced Operations,coursera,beginner
/course/tidyverse-22819,Introduction to the Tidyverse,coursera,beginner
/course/clinical-trials-analysis-presentation-statistical-110352,"Clinical Trials Analysis, Monitoring, and Presentation",coursera,beginner
/course/computing-for-cancer-informatics-71218,Computing for Cancer Informatics,coursera,beginner
/course/sodium-66052,Global Sodium Reduction Strategies,coursera,beginner
/course/video-game-world-4314,World Design for Video Games,coursera,beginner
/course/deductive-reasoning-6616,Think Again II: How to Reason Deductively,coursera,beginner
/course/visualization-for-data-journalism-16889,Visualization for Data Journalism,coursera,beginner
/course/healthcare-medical-technology-5472,Medical Technology and Evaluation,coursera,beginner
/course/poetry-workshop-4185,Sharpened Visions: A Poetry Workshop,coursera,beginner
/course/drug-commercialization-7255,Drug Commercialization ,coursera,beginner
/course/excel-essentials-9638,Excel Skills for Business: Essentials,coursera,beginner
/course/heritage-protection-6505,Heritage under Threat,coursera,beginner
/course/screening-4793,Disease Screening in Public Health,coursera,beginner
/course/datamanagement-540,Data Management for Clinical Research,coursera,beginner
/course/science-exercise-8679,Science of Exercise,coursera,beginner
/course/scanfilmtv-665,Scandinavian Film and Television,coursera,beginner
/course/writing-for-business-6595,Business Writing,coursera,beginner
/course/archaeoastronomy-7789,Archaeoastronomy,coursera,beginner
/course/music-theory-8026,Getting Started With Music Theory,coursera,beginner
/course/supply-chain-logistics-6929,Supply Chain Logistics,coursera,beginner
/course/ielts-writing-40666,IELTS Writing Section Skills Mastery,coursera,beginner
/course/financialaccounting-32116,What is Financial Accounting?,coursera,beginner
/course/toefl-reading-listening-sections-skills-mastery-40785,TOEFL Reading and Listening Sections Skills Mastery,coursera,beginner
/course/ielts-reading-section-skills-mastery-40664,IELTS Reading Section Skills Mastery,coursera,beginner
/course/identifying-attracting-and-growing-your-digital-a-25526,"Identifying, Attracting, and Growing Your Digital Audience",coursera,beginner
/course/toefl-speaking-writing-sections-skills-mastery-40786,TOEFL Speaking and Writing Sections Skills Mastery,coursera,beginner
/course/hiring-practices-40650,Hiring Practices,coursera,beginner
/course/pronunciation-american-english-project-19496,The Pronunciation of American English Project,coursera,beginner
/course/toefl-test-taking-strategies-40787,TOEFL Test-Taking Strategies,coursera,beginner
