Link,Title,Platform,Level
/course/projektplanung-das-gesamtbild-64328,Projektplanung: Das Gesamtbild,coursera,beginner
/course/bcg-uva-darden-digital-transformation-fr-37688,La transformation numérique,coursera,beginner
/course/bases-de-la-conception-experience-utilisateur-ux-94406,Bases de la conception Expérience Utilisateur (UX),coursera,beginner
/course/project-execution-running-the-project-arabic-94879,تنفيذ المشروع: تشغيل المشروع,coursera,beginner
/course/plan-de-negocios-110584,Plan de Negocios,coursera,beginner
/course/gobierno-digital-54334,Gobierno Digital,coursera,beginner
/course/networking-basics-arabic-64386,Aruba Networking Basics - Arabic  أساسيات شبكات أروبا,coursera,beginner
/course/python-crash-course-ko-60041,파이썬 단기집중과정,coursera,beginner
/course/it-security-pt-40858,Segurança de TI: defesa contra as artes negras digitais,coursera,beginner
/course/projeyi-yurutme-projeyi-hayata-gecirme-59773,Projeyi Yürütme: Projeyi Hayata Geçirme,coursera,beginner
/course/innovating-with-data-google-cloud-ja-57700,Innovating with Data and Google Cloud 日本語版,coursera,beginner
/course/machine-learning-projects-ko-60049,머신 러닝 프로젝트 구조화,coursera,beginner
/course/migrating-to-gcp-es-25513,Migrating to Google Cloud en Español,coursera,beginner
/course/primeros-auxilios-psicologicos-54341,Primeros Auxilios Psicológicos ,coursera,beginner
/course/professional-selling-skills-98195,مهارات البيع الاحترافية | Professional Selling Skills,coursera,beginner
/course/agile-project-management-arabic-92004,إدارة المشروعات في أجايل,coursera,beginner
/course/conversational-sales-es-46399,Manual de estrategias de ventas por conversación para SDR,coursera,beginner
/course/agiles-projektmanagement-64335,Agiles Projektmanagement,coursera,beginner
/course/principios-basicos-da-publicidade-em-midias-socia-39501,Princípios básicos da publicidade em mídias sociais,coursera,beginner
/course/project-initiation-starting-a-successful-project--95155,بدء المشروع: بدء مشروع ناجح,coursera,beginner
/course/building-a-marketing-plan-92039,بناء خطة التسويق |Building a Marketing Plan ‎,coursera,beginner
/course/estrategia-y-planificacion-de-marketing-89449,Estrategia y Planificación de Marketing ,coursera,beginner
/course/finanzas-y-operaciones-de-mkt-y-ventas-102540,Finanzas y Operaciones de Marketing y Ventas,coursera,beginner
/course/it-security-de-40856,IT-Sicherheit: Grundlagen für Sicherheitsarchitektur,coursera,beginner
/course/gcp-creating-bigquery-datasets-visualizi-9672,Creating New BigQuery Datasets and Visualizing Insights 日本語版,coursera,beginner
/course/introducao-ao-marketing-de-midias-sociais-39505,Introdução ao marketing de mídias sociais,coursera,beginner
/course/system-administration-it-infrastructure-services--40851,Serviços de infraestruturas e administração de sistemas,coursera,beginner
/course/crear-prototipos-y-disenos-de-alta-fidelidad-en-f-61462,Crear prototipos y diseños de alta fidelidad en Figma,coursera,beginner
/course/applying-project-management-in-the-real-world-ara-92003,كابستون: تطبيق إدارة المشروعات في العالم الحقيقي,coursera,beginner
/course/mastering-the-art-of-briefing-92040,إتقان فن الإيجاز في الحديث | Mastering The Art of Briefing,coursera,beginner
/course/microsoft-outlook-fundamentals-98193,أساسيات مايكروسوفت آوتلوك | Microsoft Outlook Fundamentals,coursera,beginner
/course/perspectivas-en-transformacion-digital-agronegoci-110585,Perspectivas en Transformación Digital: Agronegocios,coursera,beginner
/course/professional-communication-skills-sales-es-46398,Guía práctica para gestionar las relaciones profesionales,coursera,beginner
/course/mas-que-quimica-46421,Más que química,coursera,beginner
/course/gcp-advanced-insights-bigquery-jp-14474,Achieving Advanced Insights with BigQuery 日本語版,coursera,beginner
/course/google-drive-es-45901,Google Drive en Español,coursera,beginner
/course/digital-transformation-google-cloud-iw-55969,Introduction to Digital Transformation Google Cloud בעברית,coursera,beginner
/course/ask-questions-make-decisions-japanese-104050,2. データに基づいた意思決定を行うための問いかけ,coursera,beginner
/course/gcp-cost-management-es-22147,Understanding Your Google Cloud Costs en Español,coursera,beginner
/course/escritura-academica-estilos-de-citacion-y-referen-118913,Escritura académica. Estilos de citación y referenciación.,coursera,beginner
/course/system-administration-it-infrastructure-services--40854,Системное администрирование и службы IT-инфраструктуры,coursera,beginner
/course/sales-interview-es-46403,Fundamentos para entrevistar con confianza,coursera,beginner
/course/diseno-de-ux-para-el-bien-social-y-preparacion-pa-61464,Diseñar una experiencia del usuario de una iniciativa de interés público y prepararse para el trabajo,coursera,beginner
/course/ask-questions-to-make-data-driven-decisions-arabi-92007,طرح الأسئلة لاتخاذ قرارات قائمة على البيانات,coursera,beginner
/course/gestion-de-projet-agile-94430,Gestion de projet Agile,coursera,beginner
/course/project-planning-putting-it-all-together-arabic-94878,التخطيط للمشروع: وضع كل شيء معًا,coursera,beginner
/course/managing-g-suite-jp-17323,Managing Google Workspace 日本語版,coursera,beginner
/course/responsives-webdesign-in-adobe-xd-64353,Responsives Webdesign in Adobe XD,coursera,beginner
/course/analise-de-dados-com-programacao-em-r-89720,Análise de dados com programação em R,coursera,beginner
/course/start-the-ux-design-process-empathize-define-and--94681,بدء عملية تصميم تجربة المستخدم: التعاطف والتحديد والتصور,coursera,beginner
/course/cloud-computing-basics-ko-60044,클라우드 컴퓨팅 기초(Cloud 101),coursera,beginner
/course/aruba-mobility-basics-spanish-89674,Aruba Mobility Basics for Spanish Speakers ,coursera,beginner
/course/artificial-intelligence-and-big-data-fundamentals-104043,أساسيات الذكاء الاصطناعي والبيانات الضخمة | AI,coursera,beginner
/course/veiculacao-de-anuncios-com-o-facebook-39489,Veiculação de anúncios com o Meta,coursera,beginner
/course/it-security-ru-40860,Безопасность в IT: искусство борьбы с темными силами,coursera,beginner
/course/g-suite-security-jp-17322,Google Workspace Security 日本語版,coursera,beginner
/course/projektinitiierung-ein-erfolgreiches-projekt-star-64334,Projektinitiierung: Ein Erfolgreiches Projekt Starten,coursera,beginner
/course/herramientas-ofimaticas-basicas-para-el-trabajo-25487,Herramientas ofimáticas básicas para el trabajo,coursera,beginner
/course/google-docs-es-45900,Google Docs en Español,coursera,beginner
/course/digital-transformation-google-cloud-ja-57702,Introduction to Digital Transformation with Google Cloud 日本語版,coursera,beginner
/course/foundations-data-data-everywhere-arabic-94682,الأسس: البيانات، البيانات في كل مكان,coursera,beginner
/course/el-holocausto-94405,El Holocausto: el abismo de la humanidad,coursera,beginner
/course/initiation-du-projet-demarrer-un-projet-reussi-94660,Initiation au projet : Démarrer un projet réussi,coursera,beginner
/course/innovacion-en-el-mundo-corporativo-25489,Innovación en el mundo corporativo,coursera,beginner
/course/medir-e-otimizar-campanhas-de-marketing-de-midias-39480,Medir e otimizar campanhas de marketing de mídias sociais,coursera,beginner
/course/securite-informatique-defense-contre-les-pratique-94403,Sécurité informatique et dangers du numérique,coursera,beginner
/course/analyze-data-to-answer-questions-arabic-94683,تحليل البيانات للإجابة عن الأسئلة,coursera,beginner
/course/data-preparation-japanese-104049,3. 探索用データを準備する,coursera,beginner
/course/system-administration-it-infrastructure-services--40853,Systemverwaltung und IT-Infrastrukturdienste,coursera,beginner
/course/den-ux-designprozess-starten-empathie-aufbauen-fo-64346,"Den UX-Designprozess beginnen: Empathie aufbauen, Fokus definieren, Ideen entwickeln",coursera,beginner
/course/grundlagen-des-user-experience-designs-uxd-64348,Grundlagen des User Experience Designs (UXD),coursera,beginner
/course/planification-de-projet-tout-mettre-en-place-94510,Planification de projet : Tout mettre en place,coursera,beginner
/course/create-high-fidelity-designs-and-prototypes-in-fi-94676,إنشاء تصميمات ونماذج أوّلية عالية الدقة في Figma,coursera,beginner
/course/grundlagen-des-projektmanagements-64331,Grundlagen des Projektmanagements,coursera,beginner
/course/aruba-networking-basics-spanish-97260,Aruba Networking Basics for Spanish Speakers ,coursera,beginner
/course/bases-de-la-gestion-de-projet-94429,Bases de la gestion de projet,coursera,beginner
/course/process-data-from-dirty-to-clean-arabic-94685,معالجة البيانات من غير نظيفة إلى نظيفة,coursera,beginner
/course/prepare-data-for-exploration-arabic-94686,تجهيز البيانات للاستكشاف,coursera,beginner
/course/aruba-networking-basics-portuguese-64387,Aruba Networking Basics for Portuguese Speakers ,coursera,beginner
/course/idarat-wasael-al-tawasol-al-ijtimai-39477,إدارة وسائل التواصل الاجتماعي,coursera,beginner
/course/understanding-google-cloud-security-and-operation-57701,Understanding Google Cloud Security and Operations 日本語版,coursera,beginner
/course/grundlagen-daten-uberall-daten-64358,"Grundlagen: Daten, überall Daten",coursera,beginner
/course/les-bits-et-les-octets-des-reseaux-informatiques-94400, Les bits et les octets des réseaux informatiques,coursera,beginner
/course/administration-systeme-et-services-infrastructure-94404,Administration système et services d’infrastructure informatique,coursera,beginner
/course/google-data-analytics-capstone-complete-a-case-st-94684,مشروع كابستون لشهادة تحليلات البيانات من Google: الانتهاء من دراسة الحالة,coursera,beginner
/course/responsive-web-design-in-adobe-xd-arabic-94678, تصميم ويب سريع الاستجابة في Adobe XD,coursera,beginner
/course/construyendo-cloud-native-y-multicloud-35050,Construyendo Cloud Native y Multicloud,coursera,beginner
/course/innovating-with-data-google-cloud-iw-55967,Innovating with Data and Google Cloud בעברית,coursera,beginner
/course/build-wireframes-and-low-fidelity-prototypes-arab-94680,إنشاء إطارات شبكية ونماذج أوّلية منخفضة الدقة,coursera,beginner
/course/share-data-through-the-art-of-visualization-arabi-94687,مشاركة البيانات من خلال فن مؤثرات عرض التصور,coursera,beginner
/course/foundations-of-user-experience-ux-design-arabic-94675,أسس تصميم تجربة المستخدم (UX),coursera,beginner
/course/wireframes-und-low-fidelity-prototypen-erstellen-64352,Wireframes und Low-Fidelity-Prototypen Erstellen,coursera,beginner
/course/developing-a-google-sre-culture-fr-59752,Developing a Google SRE Culture en Français,coursera,beginner
/course/design-a-user-experience-for-social-good-arabic-94677,تصميم تجربة مستخدم من أجل الصالح الاجتماعي والاستعداد للوظائف,coursera,beginner
/course/bases-de-la-gestion-de-projet-google-116614,Bases de la gestion de projet,coursera,beginner
/course/stress-management-98187,إدارة ضغوط الحياة  | Stress Management,coursera,beginner
/course/gerenciamento-de-midias-sociais-39478,Gerenciamento de mídias sociais,coursera,beginner
/course/sales-enablement-tools-productivity-es-46397,Impulsa la productividad mediante la pila de tecnología,coursera,beginner
/course/google-cloud-product-fundamentals-iw-55961,Infrastructure and Application Modernization with Google Cloud בעברית,coursera,beginner
/course/projektabwicklung-das-projekt-durchfuhren-64333,Projektabwicklung: Das Projekt durchführen,coursera,beginner
/course/high-fidelity-designs-und-prototypen-in-figma-ers-64351,High-Fidelity-Designs und Prototypen in Figma Erstellen,coursera,beginner
/course/fragen-fur-eine-datengesteuerte-entscheidungsfind-64356,Fragen Für Eine Datengesteuerte Entscheidungsfindung Stellen,coursera,beginner
/course/principes-de-base-du-support-technique-94426,Principes de base du support technique,coursera,beginner
/course/conduct-ux-research-and-test-early-concepts-arabi-94679, إجراء بحث تجربة المستخدم واختبار المفاهيم المبكرة,coursera,beginner
/course/principes-de-base-du-soutien-technique-116602,Principes de base du soutien technique,coursera,beginner
/course/job-search-skills-98185,البحث عن عمل في العصر الرقمي | Job Search in the Digital Age,coursera,beginner
/course/understanding-google-cloud-security-and-operation-55973,Understanding Google Cloud Operations and Security בעברית,coursera,beginner
/course/les-systemes-exploitation-et-vous-devenir-un-util-94401,Les systèmes d’exploitation et vous : Devenir un utilisateur expérimenté,coursera,beginner
/course/poser-des-questions-pour-prendre-des-decisions-ba-94423,Poser des questions pour prendre des décisions basées sur les données,coursera,beginner
/course/innovating-with-data-google-cloud-fr-58637,Innovating with Data and Google Cloud en Français,coursera,beginner
/course/concevoirune-experience-utilisateur-pour-le-bien--98591,Concevoir une expérience utilisateur pour le bien commun et se préparer à l’emploi,coursera,beginner
/course/conduct-ux-research-de-64350,UX-Forschung Durchführen und Erste Konzepte Testen,coursera,beginner
/course/daten-fur-die-erkundung-vorbereiten-64357,Daten für die Erkundung Vorbereiten,coursera,beginner
/course/debut-du-processus-d-conception-ux-empathie-defin-94411,"Début du processus de conception UX : Empathie, définition et formulation d’idées",coursera,beginner
/course/execution-du-projet-executer-le-projet-94431,Exécuter le projet,coursera,beginner
/course/process-data-de-64359,Daten bereinigen,coursera,beginner
/course/analyser-les-donnees-pour-repondre-aux-questions-94415,Analyser les données pour répondre aux questions,coursera,beginner
/course/preparer-les-donnees-pour-exploration-94420,Préparer les données pour l'exploration,coursera,beginner
/course/creer-des-conceptions-et-des-prototypes-haute-fid-94413,Création de designs et de prototypes haute fidélité dans Figma,coursera,beginner
/course/nettoyage-de-donnees-94424,Le nettoyage de données,coursera,beginner
/course/carnet-interculturel-105181,Un carnet interculturel pour une mobilité universitaire,coursera,beginner
/course/aruba-mobility-basics-portuguese-89673,Aruba Mobility Basics for Portuguese Speakers ,coursera,beginner
/course/aruba-network-security-basics-spanish-102583,Aruba Network Security Basics for Spanish Speakers,coursera,beginner
/course/ux-design-jobs-de-64347,Eine User Experience für soziale Zwecke gestalten und sich auf die Jobsuche vorbereiten,coursera,beginner
/course/daten-uber-visualisierungen-teilen-64354,Daten über Visualisierungen teilen,coursera,beginner
/course/construire-des-armatures-et-des-prototypes-basse--94407,Construire des wireframes (maquettes fonctionnelles) et des prototypes basse fidélité,coursera,beginner
/course/les-bits-et-les-octets-des-reseaux-informatiques--116597,Les bits et les octets des réseaux informatiques,coursera,beginner
/course/mener-une-recherche-ux-et-tester-les-premiers-con-94408,Mener une recherche UX et tester les premiers concepts,coursera,beginner
/course/securite-des-ti-defense-contre-les-pratiques-somb-116595,Sécurité des TI : Défense contre les pratiques sombres du numérique,coursera,beginner
/course/lancement-du-projet-demarrer-un-projet-reussi-116685,Lancement du projet : Démarrer un projet réussi,coursera,beginner
/course/administration-systeme-et-services-infrastructure-116594,Administration système et services d’infrastructure informatique,coursera,beginner
/course/planification-de-projet-tout-mettre-en-place-goog-116686,Planification de projet : Tout mettre en place,coursera,beginner
/course/les-systeme-exploitation-et-vous-devenir-un-utili-116596,Les systèmes d’exploitation et vous : devenir un utilisateur expérimenté,coursera,beginner
/course/execution-du-projet-executer-le-projet-google-117497,Exécuter le projet,coursera,beginner
/course/information-systems-18806,Information​ ​Systems,coursera,beginner
/course/healthcare-marketplace-18925,Healthcare Marketplace,coursera,beginner
/course/integrative-health-and-medicine-18618,Integrative Health and Medicine,coursera,beginner
/course/leadership-nursing-informatics-18911,Nursing Informatics  Leadership,coursera,beginner
/course/integrative-nursing-21664,Integrative Nursing,coursera,beginner
/course/cybersecurity-cloud-25346,Cybersecurity in the Cloud,coursera,beginner
/course/analytics-for-decision-making-40222,Analytics for Decision Making,coursera,beginner
/course/social-determinants-of-health-data-to-action-104433,Social Determinants of Health: Data to Action,coursera,beginner
/course/real-world-product-management-21701,Real-World Product Management,coursera,beginner
/course/business-english-speakers-18843,Business English for Non-Native Speakers,coursera,beginner
/course/google-it-support-18565,Google IT Support,coursera,beginner
/course/mathematics-engineers-89548,Mathematics for Engineers,coursera,beginner
/course/protecting-business-innovation-89490,Protecting Business Innovation,coursera,beginner
/course/build-portfolio-website-html-css-19625,Build Your Portfolio Website with HTML and CSS,coursera,beginner
/course/android-app-development-18706,Android App Development,coursera,beginner
/course/matlab-programming-engineers-scientists-21708,MATLAB Programming for Engineers and Scientists,coursera,beginner
/course/effective-business-communication-18933,"Effective Communication: Writing, Design, and Presentation",coursera,beginner
/course/excel-vba-creative-problem-solving-18887,Excel/VBA for Creative Problem Solving,coursera,beginner
/course/everyday-excel-33486,Everyday Excel,coursera,beginner
/course/graphic-design-elements-non-designers-18910,Graphic Design Elements for Non-Designers,coursera,beginner
/course/data-collection-18801,Survey Data Collection and Analytics ,coursera,beginner
/course/digital-advertising-strategy-18897,Digital Advertising Strategy,coursera,beginner
/course/product-ideation-design-and-management-47274,"Product Ideation, Design, and Management",coursera,beginner
/course/corporate-entrepreneurship-18872,Corporate Entrepreneurship: Innovating within Corporations,coursera,beginner
/course/teacher-sel-18533,The Teacher and Social and Emotional Learning (SEL),coursera,beginner
/course/legal-aspects-of-entrepreneurship-89600,Legal Aspects of Entrepreneurship ,coursera,beginner
/course/health-effects-cannabis-thc-cbd-18693,Medical Cannabis: The Health Effects of THC and CBD,coursera,beginner
/course/biology-everywhere-21672,Biology Everywhere,coursera,beginner
/course/mind-machine-18768,Mind and Machine,coursera,beginner
/course/databases-for-data-scientists-89537,Databases for Data Scientists,coursera,beginner
/course/introduction-to-public-relations-and-the-media-89586,Introduction to Public Relations and the Media,coursera,beginner
/course/renewable-energy-89485,Renewable Energy,coursera,beginner
/course/sustainable-transformation-18906,Leading Sustainable Community Transformation,coursera,beginner
/course/international-business-32630,International Business,coursera,beginner
/course/animals-society-21694,Animals and Society,coursera,beginner
/course/our-responses-climate-change-22521,Exploring Our Responses to Climate Change,coursera,beginner
/course/meem-project-management-102557,Project Management,coursera,beginner
/course/arctic-climate-environment-geographies-21823,"Arctic Climate, Environ. & Geographies of a Changing North",coursera,beginner
/course/python-programming-data-science-104391,Expressway to Data Science: Python Programming,coursera,beginner
/course/data-science-r-programming-tidyverse-94868,Expressway to Data Science: R Programming and Tidyverse,coursera,beginner
/course/anti-racism-89656,Anti-Racism,coursera,beginner
/course/fandom-popular-culture-digital-age-41057,Fandom and Popular Culture in the Digital Age,coursera,beginner
/course/caring-for-others-36438,Caring for Others,coursera,beginner
/course/finance-for-technical-managers-102556,Finance for Technical Managers,coursera,beginner
/course/principles-of-leadership-leading-oneself-102559,Principles of Leadership: Leading Oneself,coursera,beginner
/course/text-marketing-analytics-89628,Text Marketing Analytics,coursera,beginner
/course/leading-technical-organizations-110658,Principles of Leadership: Leading Technical Organizations,coursera,beginner
/course/storying-the-self-for-leadership-and-creativity-110370,Storying the Self for Leadership and Creativity,coursera,beginner
/course/marketing-strategy-18870,Marketing Strategy,coursera,beginner
/course/marketing-mix-18730,Marketing Mix Implementation,coursera,beginner
/course/branding-the-creative-journey-18859,Branding: The Creative Journey,coursera,beginner
/course/the-journey-to-diversity-89668,"The Journey to Diversity, Inclusion and Belonging",coursera,beginner
/course/become-an-emt-18563,Become an EMT,coursera,beginner
/course/cyber-security-business-18773,Cybersecurity for Business,coursera,beginner
/course/school-health-for-children-and-adolescents-18508,School Health for Children and Adolescents,coursera,beginner
/course/computational-thinking-c-programming-18824,Computational Thinking with Beginning C Programming,coursera,beginner
/course/agile-leadership-change-management-21945,Agile Leadership,coursera,beginner
/course/introduction-applied-cryptography-18850,Introduction to Applied Cryptography,coursera,beginner
/course/advanced-system-security-design-18631,Advanced System Security Design,coursera,beginner
/course/newborn-baby-care-18526,Newborn Baby Care,coursera,beginner
/course/requirements-engineering-secure-software-18520,Requirements Engineering: Secure Software  Specifications,coursera,beginner
/course/homeland-security-cybersecurity-18886,Homeland Security and Cybersecurity,coursera,beginner
/course/secure-software-design-18834,Secure Software Design,coursera,beginner
/course/programming-unity-game-development-18855,C# Programming for Unity Game Development,coursera,beginner
/course/music-production-18938,Music Production,coursera,beginner
/course/play-guitar-20727,How to Play Guitar,coursera,beginner
/course/musicianship-specialization-18811,Developing Your Musicianship,coursera,beginner
/course/singer-songwriter-20718,The Singer Songwriter,coursera,beginner
/course/diy-musician-18639,The DIY Musician,coursera,beginner
/course/music-business-18767,Music Business ,coursera,beginner
/course/business-music-production-18848,The Business of Music Production,coursera,beginner
/course/musico-contmporaneo-18805,O Músico Contemporâneo,coursera,beginner
/course/creative-writing-18750,Creative Writing,coursera,beginner
/course/qualitative-research-design-and-methods-for-publi-21675,Qualitative Research Design and Methods for Public Health,coursera,beginner
/course/managementconsulting-94863,Management Consulting,coursera,beginner
/course/negotiation-mediation-conflict-resolution-18623,"Negotiation, Mediation and Conflict Resolution",coursera,beginner
/course/hotel-management-18727,"Hotel Management: Distribution, Revenue and Demand Management",coursera,beginner
/course/memoir-personal-essay-18871,Memoir and Personal Essay: Write About Yourself,coursera,beginner
/course/abnormal-psychology-89511,Abnormal Psychology,coursera,beginner
/course/cad-bim-jianmo-18746,CAD/BIM技術與應用,coursera,beginner
/course/supply-chain-management-18670,Supply Chain Management,coursera,beginner
/course/statistical-analysis-r-public-health-18579,Statistical Analysis with R for Public Health,coursera,beginner
/course/intro-cyber-security-18868,Introduction to Cyber Security,coursera,beginner
/course/foundations-public-health-practice-18557,Foundations of Public Health Practice,coursera,beginner
/course/strategic-leadership-impact-change-decision-makin-89649,"Strategic Leadership: Impact, Change, and Decision-Making",coursera,beginner
/course/strategic-management-18862,Strategic Management and Innovation,coursera,beginner
/course/health-systems-development-20734,Health Systems Development,coursera,beginner
/course/global-health-innovations-20738,Global Health Innovations,coursera,beginner
/course/gmph-global-disease-masterclass-20700,Global Disease Masterclass,coursera,beginner
/course/participatory-approaches-public-health-32795,Participatory Approaches in Public Health,coursera,beginner
/course/quality-improvement-healthcare-93373,Quality Improvement in Healthcare,coursera,beginner
/course/sales-operations-18519,Sales Operations/Management,coursera,beginner
/course/create-a-project-charter-with-google-docs-21368,Create a Project Charter with Google Docs,coursera,beginner
/course/ibm-cybersecurity-analyst-20732,IBM Cybersecurity Analyst,coursera,beginner
/course/sales-training-high-performing-teams-18857,Sales Training for High Performing Teams,coursera,beginner
/course/icpm-certified-supervisor-22171,ICPM Certified Supervisor,coursera,beginner
/course/google-project-management-36440,Google Project Management:,coursera,beginner
/course/google-it-automation-18564,Google IT Automation with Python,coursera,beginner
