Link,Title,Platform,Level
/course/enhance-user-interface-design-mood-boards-miro-34331,Enhance User Interface Design with Mood Boards in Miro,coursera,beginner
/course/develop-savings-plan-libreoffice-34348,Develop a Savings Plan with LibreOffice,coursera,beginner
/course/create-social-media-ads-canva-promote-business-66082,Create Social Media ads with Canva to promote your business,coursera,beginner
/course/improve-plans-strategies-graphics-creately-66345,Improve plans and strategies with graphics on Creately,coursera,beginner
/course/create-attractive-infographics-with-creately-66112,Create attractive infographics with Creately,coursera,beginner
/course/googlecloud-google-cloud-pub-sub-qwik-start-comma-74407,Google Cloud Pub/Sub: Qwik Start - Command Line,coursera,beginner
/course/googlecloud-dialogflow-cx-enable-ivr-features-for-74380,Dialogflow CX: Enable IVR Features for your Voice Agent,coursera,beginner
/course/googlecloud-troubleshooting-common-sql-errors-wit-74400,Troubleshooting Common SQL Errors with BigQuery,coursera,beginner
/course/googlecloud-working-with-json-arrays-and-structs--74351,"Working with JSON, Arrays, and Structs in BigQuery",coursera,beginner
/course/googlecloud-cloud-pubsub-with-cloud-run-cfjdl-74355,Cloud PubSub with Cloud Run,coursera,beginner
/course/googlecloud-service-accounts-and-roles-fundamenta-74358,Service Accounts and Roles: Fundamentals,coursera,beginner
/course/googlecloud-cloud-source-repositories-qwik-start--74360,Cloud Source Repositories: Qwik Start,coursera,beginner
/course/googlecloud-apis-explorer-cloud-sql-pv6ts-74363,APIs Explorer: Cloud SQL,coursera,beginner
/course/googlecloud-classify-images-of-cats-and-dogs-usin-74370,Classify Images of Cats and Dogs using Transfer Learning,coursera,beginner
/course/googlecloud-build-an-end-to-end-data-capture-pipe-74371,Build an End-to-End Data Capture Pipeline using Document AI,coursera,beginner
/course/googlecloud-securing-web-applications-with-web-se-74374,Securing Web Applications with Web Security Scanner,coursera,beginner
/course/googlecloud-setting-up-a-minecraft-server-on-goog-74496,Setting up a Minecraft Server on Google Compute Engine,coursera,beginner
/course/googlecloud-creating-an-object-detection-applicat-74525,Creating an Object Detection Application Using TensorFlow,coursera,beginner
/course/googlecloud-importing-data-to-a-firestore-databas-74468,Importing Data to a Firestore Database,coursera,beginner
/course/googlecloud-building-demand-forecasting-with-bigq-74444,Building Demand Forecasting with BigQuery ML,coursera,beginner
/course/googlecloud-dataprep-qwik-start-sbgfs-74449,Dataprep: Qwik Start,coursera,beginner
/course/googlecloud-hosting-a-web-app-on-google-cloud-usi-74450,Hosting a Web App on Google Cloud Using Compute Engine,coursera,beginner
/course/googlecloud-google-workspace-admin-getting-starte-74458,Google Workspace Admin: Getting Started,coursera,beginner
/course/googlecloud-building-batch-pipelines-in-cloud-dat-74289,Building Batch Pipelines in Cloud Data Fusion,coursera,beginner
/course/googlecloud-cloud-sql-for-postgresql-qwik-start-b-74294,Cloud SQL for PostgreSQL: Qwik Start,coursera,beginner
/course/googlecloud-fundamentals-of-cloud-logging-ekzu3-74748,Fundamentals of Cloud Logging,coursera,beginner
/course/googlecloud-data-catalog-qwik-start-vpzkb-74767,Data Catalog: Qwik Start,coursera,beginner
/course/googlecloud-google-workspace-for-education-gettin-74649,Google Workspace for Education: Getting Started,coursera,beginner
/course/googlecloud-dart-using-functions-with-lists-and-m-74674,Dart: Using Functions with Lists and Maps,coursera,beginner
/course/googlecloud-bigquery-soccer-data-ingestion-i4kw4-74714,BigQuery Soccer Data Ingestion,coursera,beginner
/course/googlecloud-configuring-iam-permissions-with-gclo-74728,Configuring IAM Permissions with gcloud,coursera,beginner
/course/googlecloud-block-one-getting-started-with-the-eo-74562,Block.one: Getting Started with The EOSIO Blockchain,coursera,beginner
/course/googlecloud-deploy-microsoft-sql-server-to-comput-74571,Deploy Microsoft SQL Server to Compute Engine,coursera,beginner
/course/googlecloud-google-sheets-getting-started-zjrp9-74630,Google Sheets: Getting Started,coursera,beginner
/course/googlecloud-managing-cloud-run-grpc-services-with-74633,Managing Cloud Run gRPC Services with API Gateway,coursera,beginner
/course/googlecloud-app-dev-deploying-the-application-int-74635,App Dev: Deploying the Application into Kubernetes Engine - Python,coursera,beginner
/course/googlecloud-using-bigquery-and-cloud-logging-to-a-74592,Using BigQuery and Cloud Logging to Analyze BigQuery Usage,coursera,beginner
/course/googlecloud-deploy-node-js-express-application-in-74593,Deploy Node.js Express Application in App Engine,coursera,beginner
/course/googlecloud-cloud-composer-qwik-start-command-lin-74606,Cloud Composer: Qwik Start - Command Line,coursera,beginner
/course/googlecloud-internet-of-things-qwik-start-hmqsw-74612,Internet of Things: Qwik Start,coursera,beginner
/course/googlecloud-api-gateway-qwik-start-cvmbi-74532,API Gateway: Qwik Start,coursera,beginner
/course/googlecloud-visualizing-billing-data-with-google--74535,Visualizing Billing Data with Google Data Studio,coursera,beginner
/course/googlecloud-using-elastic-stack-to-monitor-google-74683,Using Elastic Stack to Monitor Google Cloud,coursera,beginner
/course/googlecloud-getting-started-with-cloud-kms-ghedo-74694,Getting Started with Cloud KMS,coursera,beginner
/course/googlecloud-google-appsheet-getting-started-6vj7f-74698,Google AppSheet: Getting Started,coursera,beginner
/course/how-use-rectangle-elliptical-marquee-adobe-photos-64527,How to Use Rectangle and Elliptical Marquee: Adobe Photoshop,coursera,beginner
/course/how-use-width-tool-adobe-illustrator-64529,How to use the width tool in Adobe Illustrator,coursera,beginner
/course/customizing-color-pickers-swatches-adobe-photosho-64801,Customizing color pickers and swatches in Adobe Photoshop,coursera,beginner
/course/get-started-with-wix-92052,Get started with Wix,coursera,beginner
/course/googlecloud-user-authentication-identity-aware-pr-84706,User Authentication: Identity-Aware Proxy,coursera,beginner
/course/generate-reports-help-flow-power-apps-106137,Generate Reports with the Help of a Flow Inside Power Apps,coursera,beginner
/course/ds-pitfalls-43823,Avoiding Data Science Pitfalls,coursera,beginner
/course/conwip-simulation-rsimmer-46409,Simulation of CONWIP Production Control Using R Simmer ,coursera,beginner
/course/manage-and-schedule-content-in-facebook-creator-s-86325,Manage and schedule content in Facebook Creator Studio,coursera,beginner
/course/machinedeep-learning-for-mining-quality-predictio-86178,Machine/Deep Learning for Mining Quality Prediction-Enhanced,coursera,beginner
/course/build-app-adalo-86184,Build an App with Adalo,coursera,beginner
/course/getting-started-picmonkey-small-businesses-66002,Getting started with PicMonkey for Small Businesses,coursera,beginner
/course/first-steps-visme-66006,First Steps in Visme,coursera,beginner
/course/create-interactive-prototypes-pidoco-66010,Create Interactive Prototypes with Pidoco,coursera,beginner
/course/manage-azure-blob-storage-lifecycle-93365,Manage Azure Blob Storage Lifecycle,coursera,beginner
/course/solid-programming-interface-segregation-principle-117491,SOLID Programming: Interface Segregation Principle in Unity,coursera,beginner
/course/power-apps-beginners-easy-stocktaking-ai-builder-116867,Power Apps for Beginners: Easy Stocktaking with AI Builder,coursera,beginner
/course/pest-analysis-service-blueprints-miro-39337,PEST Analysis with Service Blueprints in Miro ,coursera,beginner
/course/gain-actionable-feedback-4ls-retrospective-miro-39343,Gain Actionable Feedback with a 4Ls Retrospective in Miro,coursera,beginner
/course/engagement-mapping-enhance-user-experience-miro-40823,Engagement Mapping to Enhance the User Experience in Miro,coursera,beginner
/course/create-csharp-ui-linux-monodevelop-40867,Create a C# UI on Linux using MonoDevelop,coursera,beginner
/course/hugo-website-firebase-pipeline-46044,Deploy a Hugo Website with Cloud Build and Firebase Pipeline,coursera,beginner
/course/how-to-create-a-newsletter-on-twitter-using-revue-47984,How to create a Newsletter on Twitter using Revue,coursera,beginner
/course/create-official-appointments-using-calendly-47932,Create official appointments using Calendly,coursera,beginner
/course/quantitative-text-analysis-and-evaluating-lexical-57740,Quantitative Text Analysis and Evaluating Lexical Style in R,coursera,beginner
/course/how-to-create-multiple-automations-using-ifttt-47937,How to Create Multiple Automations using IFTTT,coursera,beginner
/course/how-to-do-a-live-broadcast-on-facebook-56008,How to do a live broadcast on Facebook,coursera,beginner
/course/how-to-create-a-facebook-ad-from-your-page-56014,How to Create a Facebook Ad from your Page,coursera,beginner
/course/identify-one-source-truth-project-wall-miro-34345,Identify One Source of Truth with a Project Wall in Miro,coursera,beginner
/course/create-landscapes-unity-part-two-trees-wind-65139,Create Landscapes in Unity Part 2 - Trees and Wind,coursera,beginner
/course/create-buyer-persona-diagram-businesses-creately-66319,Create a buyer persona diagram for businesses with Creately,coursera,beginner
/course/create-bc-qr-codes-photoshop-89464,Create Business Cards with a QR Code in Photoshop,coursera,beginner
/course/fundamentals-of-document-accessibility-64974,Fundamentals of Document Accessibility,coursera,beginner
/course/googlecloud-shared-drives-getting-started-pqhkq-74428,Shared Drives: Getting Started,coursera,beginner
/course/googlecloud-hello-cloud-run-9a9bw-74434,Hello Cloud Run,coursera,beginner
/course/googlecloud-design-conversational-flows-for-your--74381,Design Conversational Flows for your Agent,coursera,beginner
/course/googlecloud-app-engine-qwik-start-python-gtsbd-74385,App Engine: Qwik Start - Python,coursera,beginner
/course/googlecloud-app-engine-qwik-start-java-jp6zm-74386,App Engine: Qwik Start - Java,coursera,beginner
/course/googlecloud-creating-a-data-warehouse-through-joi-74401,Creating a Data Warehouse Through Joins and Unions,coursera,beginner
/course/googlecloud-translate-text-with-the-cloud-transla-74404,Translate Text with the Cloud Translation API,coursera,beginner
/course/googlecloud-cloud-sql-for-postgresql-database-obs-74275,Cloud SQL for PostgreSQL Database Observability and Tuning,coursera,beginner
/course/googlecloud-building-realtime-pipelines-in-cloud--74279,Building Realtime Pipelines in Cloud Data Fusion,coursera,beginner
/course/googlecloud-building-transformations-and-preparin-74283,Building Transformations and Preparing Data with Wrangler in Cloud Data Fusion,coursera,beginner
/course/googlecloud-blockapps-strato-spin-up-a-blockchain-74372,BlockApps STRATO: Spin Up A Blockchain Node in 3 minutes,coursera,beginner
/course/googlecloud-getting-started-with-netapp-cloud-man-74313,Getting Started with NetApp Cloud Manager & Cloud Volumes ONTAP for Google Cloud,coursera,beginner
/course/googlecloud-creating-measures-and-dimensions-usin-74316,Creating Measures and Dimensions Using LookML,coursera,beginner
/course/googlecloud-using-prometheus-for-monitoring-on-go-74504,Using Prometheus for Monitoring on Google Cloud: Qwik Start,coursera,beginner
/course/googlecloud-entity-and-sentiment-analysis-with-th-74505,Entity and Sentiment Analysis with the Natural Language API,coursera,beginner
/course/googlecloud-monitoring-and-logging-for-cloud-func-74520,Monitoring and Logging for Cloud Functions,coursera,beginner
/course/googlecloud-identifying-and-resolving-application-74471,Identifying and Resolving Application Latency for Site Reliability Engineers,coursera,beginner
/course/googlecloud-vpc-networking-fundamentals-hjpdt-74488,VPC Networking Fundamentals,coursera,beginner
/course/googlecloud-apis-explorer-cloud-storage-vyl1r-74285,APIs Explorer: Cloud Storage,coursera,beginner
/course/googlecloud-bigquery-qwik-start-command-line-nkgk-74291,BigQuery: Qwik Start - Command Line,coursera,beginner
/course/googlecloud-datastore-qwik-start-mjbwh-74292,Datastore: Qwik Start,coursera,beginner
/course/how-to-store-blob-objects-in-microsoft-azure-stor-74243,How to Use Blob Objects in Azure Storage Account like a Pro,coursera,beginner
/course/googlecloud-a-tour-of-google-cloud-sustainability-74768,A Tour of Google Cloud Sustainability,coursera,beginner
/course/googlecloud-using-bigquery-with-c-ydycl-74770,Using BigQuery with C#,coursera,beginner
/course/googlecloud-deploying-an-open-source-cassandra-tm-74772,Deploying an Open Source Cassandra™ Database using the GCP Marketplace,coursera,beginner
/course/googlecloud-getting-started-with-bigquery-machine-74648,Getting Started with BigQuery Machine Learning,coursera,beginner
/course/googlecloud-4-in-a-row-game-development-with-goog-74661,4 In A Row Game Development with Google Cloud + Unity,coursera,beginner
/course/googlecloud-using-custom-fields-in-looker-explore-74670,Using Custom Fields in Looker Explores,coursera,beginner
/course/googlecloud-dart-introducing-class-abstraction-8f-74673,Dart: Introducing Class Abstraction,coursera,beginner
/course/googlecloud-authentication-authorization-and-iden-74711,"Authentication, Authorization, and Identity with Vault",coursera,beginner
/course/googlecloud-bigquery-soccer-data-analytical-insig-74717,BigQuery Soccer Data Analytical Insight,coursera,beginner
/course/googlecloud-how-to-use-a-network-policy-on-google-74725,How to Use a Network Policy on Google Kubernetes Engine,coursera,beginner
/course/googlecloud-pipeline-graphs-with-cloud-data-fusio-74558,Pipeline Graphs with Cloud Data Fusion,coursera,beginner
/course/googlecloud-understanding-and-analyzing-your-cost-74565,Understanding and Analyzing Your Costs with Google Cloud Billing Reports,coursera,beginner
/course/googlecloud-ingesting-dicom-data-with-the-healthc-74575,Ingesting DICOM Data with the Healthcare API,coursera,beginner
/course/googlecloud-managing-google-classroom-l5u28-74624,Managing Google Classroom,coursera,beginner
/course/googlecloud-modernizing-applications-with-apigee--74641,Modernizing Applications with Apigee X,coursera,beginner
/course/googlecloud-integrating-bigquery-ml-with-dialogfl-74645,Integrating BigQuery ML with Dialogflow ES Chatbot,coursera,beginner
/course/googlecloud-dataflow-qwik-start-templates-jvtzv-74587,Dataflow: Qwik Start - Templates,coursera,beginner
/course/googlecloud-cloud-spanner-qwik-start-ig8tq-74601,Cloud Spanner: Qwik Start,coursera,beginner
/course/googlecloud-bigquery-qwik-start-console-m30ek-74554,BigQuery: Qwik Start - Console,coursera,beginner
/course/googlecloud-app-engine-qwik-start-php-clhcd-74682,App Engine: Qwik Start - PHP,coursera,beginner
/course/googlecloud-filtering-and-sorting-data-in-looker--74701,Filtering and Sorting Data in Looker,coursera,beginner
/course/how-use-frame-tool-adobe-photoshop-64526,How to use the Frame Tool in Adobe Photoshop,coursera,beginner
/course/how-draw-curvature-tool-adobe-illustrator-64531,How to draw with the curvature tool in Adobe Illustrator,coursera,beginner
/course/create-ux-portfolio-adobe-portfolio-64791,Create your UX portfolio with Adobe Portfolio,coursera,beginner
/course/googlecloud-troubleshooting-workloads-on-gke-for--80411,Troubleshooting Workloads on GKE for Site Reliability Engineers,coursera,beginner
/course/googlecloud-google-cloud-speech-api-qwik-start-iv-80048,Google Cloud Speech API: Qwik Start,coursera,beginner
/course/googlecloud-looker-functions-and-operators-j9rv9-80460,Looker Functions and Operators,coursera,beginner
/course/googlecloud-serverless-orchestration-with-workflo-81458,Serverless Orchestration with Workflows,coursera,beginner
/course/create-react-forms-using-hooks-92428,Create React Forms Using Hooks,coursera,beginner
/course/create-a-quiz-using-microsoft-forms-92377,Create a quiz using Microsoft Forms,coursera,beginner
/course/googlecloud-introduction-to-computer-vision-with--97482,Introduction to Computer Vision with TensorFlow,coursera,beginner
/course/leverage-johari-window-develop-strong-teams-miro-43798,Leverage a Johari Window to Develop Strong Teams in Miro,coursera,beginner
/course/edit-and-retouch-images-with-canva-86332,Edit and retouch images with Canva,coursera,beginner
/course/create-edit-pinterest-ad-account-86333,Create and Edit a Pinterest Ad Account,coursera,beginner
/course/use-pastel-ux-design-86334,Use Pastel in UX Design,coursera,beginner
/course/create-attractive-infographics-with-piktochart-86310, Create attractive infographics with Piktochart,coursera,beginner
/course/get-started-with-piktochart-86311,Get started with Piktochart ,coursera,beginner
/course/using-animations-and-transitions-in-libre-impress-66029, Using Animations and Transitions in Libre Impress,coursera,beginner
/course/building-digital-media-using-graphic-design-in-li-66030,Building Digital Media using Graphic Design in Libre Impress,coursera,beginner
/course/create-charts-graphs-visme-70703,Create Charts and Graphs in Visme,coursera,beginner
/course/googlecloud-data-publishing-on-bigquery-using-aut-94417,Data Publishing on BigQuery using Authorized Views for Data Sharing Partners,coursera,beginner
/course/googlecloud-analytics-as-a-service-for-data-shari-94422,Analytics as a Service for Data Sharing Partners,coursera,beginner
/course/googlecloud-consuming-customer-specific-datasets--94425,Consuming Customer Specific Datasets from Data Sharing Partners using BigQuery,coursera,beginner
/course/solving-ml-regression-problem-with-aws-autogluon-99655,Solving ML Regression Problems with AWS AutoGluon,coursera,beginner
/course/optimize-instagram-business-profile-91763,How to optimize your Instagram Business Profile,coursera,beginner
/course/design-infographics-with-prezi-91767,Design infographics with Prezi ,coursera,beginner
/course/compare-models-with-experiments-in-azure-ml-studi-102542,Compare Models with Experiments in Azure ML Studio,coursera,beginner
/course/getting-started-with-azure-cosmos-db-102553,Getting started with Azure Cosmos DB,coursera,beginner
/course/line-balancing-milp-rstudio-110434,Line Balancing With MILP Optimization In RStudio,coursera,beginner
/course/look-mock-analyze-find-strengths-weaknesses-miro-39346,Look Mock Analyze to Find Strengths & Weaknesses in Miro ,coursera,beginner
/course/video-intelligence-api-46040,Analyzing a Tennis Serve with the Video Intelligence API,coursera,beginner
/course/create-a-customer-satisfaction-survey-with-typefo-25506,Create a customer satisfaction survey with Typeform,coursera,beginner
/course/ncaa-data-bigquery-48226,Exploring NCAA Data with BigQuery,coursera,beginner
/course/how-to-import-contacts-to-mailchimp-54608,How to Import Contacts to Mailchimp,coursera,beginner
/course/design-corporate-presentations-with-piktochart-86351,Design corporate presentations with Piktochart,coursera,beginner
/course/create-free-marketing-calendar-co-schedule-66323,Create a Free Marketing Calendar with CoSchedule,coursera,beginner
/course/googlecloud-block-one-creating-a-multi-node-eosio-74435,Block.one: Creating a Multi Node EOSIO Blockchain,coursera,beginner
/course/googlecloud-protecting-endpoints-with-recaptcha-e-74376,Protecting Endpoints with reCAPTCHA Enterprise,coursera,beginner
/course/googlecloud-dialogflow-cx-managing-environments-5-74388,Dialogflow CX: Managing Environments,coursera,beginner
/course/googlecloud-create-and-test-a-document-ai-process-74393,Create and Test a Document AI Processor,coursera,beginner
/course/googlecloud-gke-autopilot-qwik-start-nu5ep-74395,GKE Autopilot: Qwik Start,coursera,beginner
/course/googlecloud-collect-metrics-from-exporters-using--74396,Collect Metrics from Exporters using the Managed Service for Prometheus,coursera,beginner
/course/googlecloud-google-cloud-sdk-qwik-start-redhat-ce-74270,Google Cloud SDK: Qwik Start - Redhat/Centos,coursera,beginner
/course/googlecloud-palo-alto-networks-vm-series-advanced-74347,Palo Alto Networks VM-Series Advanced Threat Detection,coursera,beginner
/course/googlecloud-creating-date-partitioned-tables-in-b-74352,Creating Date-Partitioned Tables in BigQuery,coursera,beginner
/course/googlecloud-creating-dynamic-secrets-for-google-c-74354,Creating Dynamic Secrets for Google Cloud with Vault,coursera,beginner
/course/googlecloud-ingesting-new-datasets-into-bigquery--74356,Ingesting New Datasets into BigQuery,coursera,beginner
/course/googlecloud-creating-permanent-tables-and-access--74357,Creating Permanent Tables and Access-Controlled Views in BigQuery,coursera,beginner
/course/googlecloud-cloud-endpoints-qwik-start-tetvn-74315,Cloud Endpoints: Qwik Start,coursera,beginner
/course/googlecloud-form-parsing-using-document-ai-xqi2n-74318,Form Parsing Using Document AI,coursera,beginner
/course/googlecloud-eventarc-for-cloud-run-rupds-74323,Eventarc for Cloud Run,coursera,beginner
/course/googlecloud-leverage-the-autoscaler-tool-for-clou-74341,Leverage the Autoscaler Tool for Cloud Spanner to Achieve Workload Elasticity,coursera,beginner
/course/googlecloud-cloud-scheduler-qwik-start-onm8b-74502,Cloud Scheduler: Qwik Start,coursera,beginner
/course/googlecloud-google-cloud-storage-bucket-lock-osb2-74512,Google Cloud Storage - Bucket Lock,coursera,beginner
/course/googlecloud-using-gsutil-to-perform-operations-on-74519,Using gsutil to Perform Operations on Buckets and Objects,coursera,beginner
/course/googlecloud-securing-apis-with-apigee-x-t3hay-74523,Securing APIs with Apigee X,coursera,beginner
/course/googlecloud-building-virtual-agent-fulfillment-fi-74478,Building Virtual Agent Fulfillment,coursera,beginner
/course/googlecloud-pub-sub-lite-qwik-start-r1cnc-74481,Pub/Sub Lite: Qwik Start,coursera,beginner
/course/googlecloud-internal-load-balancer-zfbfn-74485,Internal Load Balancer,coursera,beginner
/course/googlecloud-using-memorystore-for-redis-read-repl-74491,Using Memorystore for Redis Read Replicas to Improve Read Performance,coursera,beginner
/course/googlecloud-network-tiers-optimizing-network-spen-74464,Network Tiers - Optimizing Network Spend,coursera,beginner
/course/googlecloud-loading-your-own-data-into-bigquery-a-74287,Loading Your Own Data into BigQuery,coursera,beginner
/course/googlecloud-cloud-logging-on-kubernetes-engine-jp-74747,Cloud Logging on Kubernetes Engine,coursera,beginner
/course/googlecloud-prisma-cloud-securing-gke-run-time-ya-74750,Prisma Cloud: Securing GKE Run Time,coursera,beginner
/course/googlecloud-deploy-scale-and-update-your-website--74753,"Deploy, Scale, and Update Your Website on Google Kubernetes Engine",coursera,beginner
/course/googlecloud-bracketology-with-google-machine-lear-74646,Bracketology with Google Machine Learning,coursera,beginner
/course/googlecloud-getting-started-with-vault-ngbj9-74652,Getting Started with Vault,coursera,beginner
/course/googlecloud-google-workspace-for-education-managi-74653,Google Workspace for Education: Managing Services,coursera,beginner
/course/googlecloud-cloud-ids-qwik-start-ugzxk-74654,Cloud IDS: Qwik Start,coursera,beginner
/course/googlecloud-redacting-sensitive-data-with-the-dlp-74657,Redacting Sensitive Data with the DLP API,coursera,beginner
/course/googlecloud-deploy-your-website-on-cloud-run-sdz2-74659,Deploy Your Website on Cloud Run,coursera,beginner
/course/googlecloud-securing-google-cloud-with-cft-scorec-74660,Securing Google Cloud with CFT Scorecard,coursera,beginner
/course/googlecloud-visualize-the-10-000-bitcoin-pizza-tr-74663,"Visualize the 10,000 Bitcoin Pizza Transaction Using BigQuery and AI Notebooks",coursera,beginner
/course/googlecloud-dialogflow-cx-contextual-intents-aajj-74668,Dialogflow CX: Contextual Intents,coursera,beginner
/course/googlecloud-dialogflow-cx-parameter-manipulation--74669,Dialogflow CX: Parameter Manipulation,coursera,beginner
/course/googlecloud-creating-a-looker-modeled-query-and-w-74671,Creating a Looker Modeled Query and Working with Quick Start,coursera,beginner
/course/googlecloud-identifying-bias-in-mortgage-data-usi-74707,Identifying Bias in Mortgage Data using Cloud AI Platform and the What-if Tool,coursera,beginner
/course/googlecloud-migrating-an-application-and-data-fro-74709,Migrating an application and data from Apache Cassandra™ to DataStax Enterprise,coursera,beginner
/course/googlecloud-reduce-costs-for-the-managed-service--74721,Reduce Costs for the Managed Service for Prometheus,coursera,beginner
/course/googlecloud-google-meet-getting-started-mnnhr-74723,Google Meet: Getting Started,coursera,beginner
/course/googlecloud-using-agones-to-easily-create-scalabl-74730,Using Agones to Easily Create Scalable Game Servers,coursera,beginner
/course/googlecloud-google-workspace-admin-provisioning-q-74731,Google Workspace Admin: Provisioning,coursera,beginner
/course/googlecloud-apis-explorer-qwik-start-3gtd4-74734,APIs Explorer: Qwik Start,coursera,beginner
/course/googlecloud-using-google-cloud-services-with-apig-74736,Using Google Cloud Services with Apigee X,coursera,beginner
/course/googlecloud-configuring-and-deploying-windows-sql-74561,Configuring and Deploying Windows SQL Server on Google Cloud,coursera,beginner
/course/googlecloud-running-windows-containers-on-compute-74564,Running Windows Containers on Compute Engine,coursera,beginner
/course/googlecloud-the-apps-script-cli-clasp-668tw-74574,The Apps Script CLI - clasp,coursera,beginner
/course/googlecloud-container-registry-qwik-start-g0wrh-74622,Container Registry: Qwik Start,coursera,beginner
/course/googlecloud-cloud-sql-for-sql-server-qwik-start-x-74623,Cloud SQL for SQL Server: Qwik Start,coursera,beginner
/course/googlecloud-adding-an-apigee-x-environment-and-gr-74634,Adding an Apigee X Environment and Group,coursera,beginner
/course/googlecloud-connect-and-configure-data-for-your-a-74642,Connect and Configure Data for your AppSheet App,coursera,beginner
