Link,Title,Platform,Level
/course/edx-agile-leadership-principles-and-practices-11920,Agile Leadership Principles and Practices,edx,advanced
/course/edx-agile-innovation-and-problem-solving-skills-11919,Agile Innovation and Problem Solving Skills,edx,advanced
/course/edx-applied-scrum-for-agile-project-management-11917,Applied Scrum for Agile Project Management,edx,advanced
/course/edx-agile-process-project-and-program-controls-11921,"Agile Process, Project, and Program Controls",edx,advanced
/course/edx-sprint-planning-for-faster-agile-team-delivery-11918,Sprint Planning for Faster Agile Team Delivery,edx,advanced
/course/edx-molecular-biology-part-1-dna-replication-and-repair-2907,Molecular Biology - Part 1: DNA Replication and Repair,edx,advanced
/course/edx-excel-avanzado-importacion-y-analisis-de-datos-10329,Excel avanzado: importación y análisis de datos,edx,advanced
/course/edx-python-for-data-science-8209,Python for Data Science,edx,advanced
/course/edx-probability-the-science-of-uncertainty-and-data-1496,Probability - The Science of Uncertainty and Data,edx,advanced
/course/edx-molecular-biology-part-2-transcription-and-transposition-4072,Molecular Biology - Part 2: Transcription and Transposition,edx,advanced
/course/edx-mining-massive-datasets-2406,Mining Massive Datasets,edx,advanced
/course/edx-automata-theory-376,Automata Theory,edx,advanced
/course/edx-machine-learning-with-python-from-linear-models-to-deep-learning-11483,Machine Learning with Python: from Linear Models to Deep Learning,edx,advanced
/course/edx-probability-and-statistics-in-data-science-using-python-8213,Probability and Statistics in Data Science using Python,edx,advanced
/course/edx-convex-optimization-1577,Convex Optimization,edx,advanced
/course/edx-cybersecurity-fundamentals-7844,Cybersecurity Fundamentals,edx,advanced
/course/mathematical-and-computational-methods-27989,Mathematical and Computational Methods,edx,advanced
/course/edx-high-dimensional-data-analysis-2949,High-Dimensional Data Analysis,edx,advanced
/course/edx-thinking-critically-interpreting-randomized-clinical-trials-5703,Thinking Critically: Interpreting Randomized Clinical Trials,edx,advanced
/course/edx-advanced-bioconductor-2976,Advanced Bioconductor,edx,advanced
/course/edx-fundamentals-of-statistics-11482,Fundamentals of Statistics,edx,advanced
/course/edx-case-studies-in-functional-genomics-2973,Case Studies in Functional Genomics,edx,advanced
/course/mlops-for-scaling-tinyml-66338,MLOps for Scaling TinyML,edx,advanced
/course/edx-type-2-diabetes-management-19116,Type 2 Diabetes Management,edx,advanced
/course/edx-health-across-the-gender-spectrum-19163,Health Across the Gender Spectrum,edx,advanced
/course/edx-prescription-drug-misuse-and-addiction-compassionate-care-for-a-complex-problem-5144,Prescription Drug Misuse and Addiction: Compassionate Care for a Complex Problem,edx,advanced
/course/edx-molecular-biology-part-3-rna-processing-and-translation-7402,Molecular Biology – Part 3: RNA Processing and Translation,edx,advanced
/course/edx-an-evidence-based-approach-to-the-diagnosis-and-management-of-migraines-in-adults-in-the-primary-care-and-general-neurology-setting-19117,An Evidence-Based Approach to the Diagnosis and Management of Migraines in Adults in the Primary Care and General Neurology Setting,edx,advanced
/course/edx-hypertension-in-primary-care-improving-control-and-reducing-risk-19118,Hypertension in Primary Care – Improving Control and Reducing Risk,edx,advanced
/course/edx-thinking-critically-series-interpreting-screening-trials-19121,Thinking Critically Series: Interpreting Screening Trials,edx,advanced
/course/edx-congenital-hypothyroidism-what-every-primary-care-provider-needs-to-know-5698,Congenital Hypothyroidism: What Every Primary Care Provider Needs to Know,edx,advanced
/course/edx-identifying-early-signs-of-psychosis-in-adolescents-and-young-adults-19208,Identifying Early Signs of Psychosis in Adolescents and Young Adults,edx,advanced
/course/edx-presentation-and-management-of-pediatric-acute-onset-neuropsychiatric-syndrome-pans-19209,Presentation and Management of Pediatric Acute-Onset Neuropsychiatric Syndrome (PANS),edx,advanced
/course/edx-safetyquest-level-one-qi-basics-19210,SafetyQuest: Level One - QI Basics,edx,advanced
/course/edx-to-prescribe-or-not-to-prescribe-antibiotics-and-outpatient-infections-19313,To Prescribe or Not To Prescribe? Antibiotics and Outpatient Infections,edx,advanced
/course/edx-managing-atrial-fibrillation-19315,Managing Atrial Fibrillation,edx,advanced
/course/edx-antimicrobial-stewardship-improving-clinical-outcomes-by-optimization-of-antibiotic-practices-19312,Antimicrobial Stewardship: Improving Clinical Outcomes By Optimization of Antibiotic Practices,edx,advanced
/course/edx-cell-biology-transport-and-signaling-20117,Cell Biology: Transport and Signaling,edx,advanced
/course/edx-musculoskeletal-primer-for-the-non-orthopedist-19316,Musculoskeletal Primer for the Non-Orthopedist,edx,advanced
/course/edx-csi-me-case-studies-in-medical-errors-19130,CSI: ME Case Studies in Medical Errors,edx,advanced
/course/edx-optimizing-antimicrobial-therapy-with-timeouts-19314,Optimizing Antimicrobial Therapy with Timeouts,edx,advanced
/course/edx-identifying-and-responding-to-developmental-delay-in-young-children-19162,Identifying and Responding to Developmental Delay in Young Children,edx,advanced
/course/edx-how-to-taper-patients-off-of-chronic-opioid-therapy-19135,How To Taper Patients Off Of Chronic Opioid Therapy,edx,advanced
/course/edx-neuromuscular-monitoring-course-19160,Neuromuscular Monitoring Course,edx,advanced
/course/edx-safetyquest-level-four-mastering-qi-19211,SafetyQuest: Level Four - Mastering QI,edx,advanced
/course/edx-safetyquest-level-two-moving-beyond-qi-basics-19213,SafetyQuest: Level Two - Moving Beyond QI Basics,edx,advanced
/course/edx-safetyquest-level-three-implementing-qi-19212,SafetyQuest: Level Three - Implementing QI,edx,advanced
/course/edx-dementia-and-diversity-in-primary-care-african-american-populations-19131,Dementia and Diversity in Primary Care: African American Populations,edx,advanced
/course/evaluating-student-work-performance-assessments-g-45920,Evaluating Student Work from Performance Assessments to Guide NGSS Teaching and Learning: Course 4,edx,advanced
/course/cell-biology-3-40246,Cell Biology: Cell-Cell Interactions,edx,advanced
/course/edx-supply-chain-design-4067,Supply Chain Design,edx,advanced
/course/cell-biology-2-22832,Cell Biology: The Cytoskeleton and Cell Cycle,edx,advanced
/course/edx-solar-energy-photovoltaic-pv-energy-conversion-8187,Solar Energy: Photovoltaic (PV) Energy Conversion,edx,advanced
/course/edx-solar-energy-photovoltaic-pv-systems-8188,Solar Energy: Photovoltaic (PV) Systems,edx,advanced
/course/edx-solar-energy-integration-of-photovoltaic-systems-in-microgrids-8166,Solar Energy: Integration of Photovoltaic Systems in Microgrids,edx,advanced
/course/edx-solar-energy-photovoltaic-pv-technologies-8177,Solar Energy: Photovoltaic (PV) Technologies,edx,advanced
/course/edx-electronic-materials-and-devices-3211,Electronic Materials and Devices,edx,advanced
/course/edx-discrete-time-signal-processing-2651,Discrete-Time Signal Processing,edx,advanced
/course/edx-introduction-to-aerodynamics-931,Introduction to Aerodynamics,edx,advanced
/course/edx-supply-chain-dynamics-4807,Supply Chain Dynamics,edx,advanced
/course/edx-foundations-of-modern-finance-i-18037,Foundations of Modern Finance  I,edx,advanced
/course/edx-machine-learning-fundamentals-8216,Machine Learning Fundamentals,edx,advanced
/course/microstructural-evolution-part-1-32694,Microstructural Evolution of Materials Part 1: Statistical Mechanics,edx,advanced
/course/advanced-fluid-mechanics-2-27995,Advanced Fluid Mechanics 2: The Navier-Stokes Equations for Viscous Flows,edx,advanced
/course/statistics-computation-and-applications-22414,Data Analysis: Statistical Modeling and Computation in Applications,edx,advanced
/course/edx-international-law-3179,International Law,edx,advanced
/course/program-management-fundamentals-governing-with-ex-58653,Program Management Fundamentals – Governing with Excellence to Drive Strategic Change,edx,advanced
/course/edx-the-history-of-medieval-medicine-through-jewish-manuscripts-6301,The History of Medieval Medicine Through Jewish Manuscripts,edx,advanced
/course/edx-robotics-kinematics-and-mathematical-foundations-8197,Robotics: Kinematics and Mathematical Foundations,edx,advanced
/course/edx-supply-chain-technology-and-systems-6366,Supply Chain Technology and Systems,edx,advanced
/course/edx-financial-accounting-18040,Financial Accounting,edx,advanced
/course/edx-mathematical-methods-for-quantitative-finance-18041,Mathematical Methods for Quantitative Finance,edx,advanced
/course/edx-principles-of-synthetic-biology-4085,Principles of Synthetic Biology,edx,advanced
/course/edx-supply-chains-for-manufacturing-inventory-analytics-10287,Supply Chains for Manufacturing: Inventory Analytics,edx,advanced
/course/edx-derivatives-markets-advanced-modeling-and-strategies-18042,Derivatives Markets: Advanced Modeling and Strategies,edx,advanced
/course/edx-supply-chain-comprehensive-exam-8479,Supply Chain Comprehensive Exam,edx,advanced
/course/edx-foundations-of-modern-finance-ii-18039,Foundations of Modern Finance II,edx,advanced
/course/edx-sustainable-energy-21119,Sustainable Energy,edx,advanced
/course/edx-cybersecurity-for-critical-urban-infrastructure-19604,Cybersecurity for Critical Urban Infrastructure,edx,advanced
/course/edx-mobile-application-experiences-part-2-mobile-app-design-5724,Mobile Application Experiences Part 2: Mobile App Design,edx,advanced
/course/edx-optical-materials-and-devices-6012,Optical Materials and Devices,edx,advanced
/course/edx-global-health-informatics-to-improve-quality-of-care-7886,Global Health Informatics to Improve Quality of Care,edx,advanced
/course/advanced-fluid-mechanics-1-22514,Advanced Fluid Mechanics 1: Fundamentals,edx,advanced
/course/edx-electronic-optical-and-magnetic-properties-of-materials-9710,"Electronic, Optical, and Magnetic Properties of Materials",edx,advanced
/course/edx-analysis-of-transport-phenomena-i-mathematical-methods-11638,Analysis of Transport Phenomena I: Mathematical Methods,edx,advanced
/course/edx-manufacturing-process-control-ii-10293,Manufacturing Process Control II,edx,advanced
/course/edx-magnetic-materials-and-devices-6028,Magnetic Materials and Devices,edx,advanced
/course/edx-collaborative-data-science-for-healthcare-21608,Collaborative Data Science for Healthcare,edx,advanced
/course/edx-cellular-solids-part-1-structures-properties-and-engineering-applications-13062,"Cellular Solids Part 1: Structures, Properties and Engineering Applications",edx,advanced
/course/edx-photonic-integrated-circuits-1-13331,Photonic Integrated Circuits 1,edx,advanced
/course/energy-economics-and-policy-58172,Energy Economics and Policy,edx,advanced
/course/principles-of-modeling-simulations-and-control-fo-41113,"Principles of Modeling, Simulations, and Control for Electric Energy Systems",edx,advanced
/course/physics-of-covid-19-transmission-22471,Physics of COVID-19 Transmission,edx,advanced
/course/edx-cellular-solids-part-2-applications-in-medicine-18136,Cellular Solids Part 2: Applications in Medicine,edx,advanced
/course/genetics-part-1-104246,Genetics: The Fundamentals,edx,advanced
/course/advanced-fluid-mechanics-3-34375,Advanced Fluid Mechanics 3: Potential Flows & Boundary Layers,edx,advanced
/course/edx-cellular-solids-part-3-applications-in-nature-18135,Cellular Solids Part 3: Applications in Nature,edx,advanced
/course/edx-cellular-solids-part-2-applications-in-medicine-5177,Cellular Solids Part 2: Applications in Medicine,edx,advanced
/course/edx-cellular-solids-part-3-applications-in-nature-5182,Cellular Solids Part 3: Applications in Nature,edx,advanced
/course/edx-capstone-exam-materials-for-electronic-optical-and-magnetic-devices-16966,"Capstone Exam – Materials for Electronic, Optical, and Magnetic Devices",edx,advanced
/course/microstructural-evolution-in-materials-2-47901,Microstructural Evolution of Materials Part 2: Defects and Diffusion,edx,advanced
/course/microstructural-evolution-of-materials-part-3-59064,Microstructural Evolution of Materials: Surfaces and Surface-Driven Reactions,edx,advanced
/course/microstructural-evolution-of-materials-part-4-80075,Microstructural Evolution in Materials: Phase Transformations,edx,advanced
/course/edx-computing-for-data-analysis-8223,Computing for Data Analysis,edx,advanced
/course/edx-the-tabernacle-in-word-image-an-italian-jewish-manuscript-revealed-11462,The Tabernacle in Word & Image: An Italian Jewish Manuscript Revealed,edx,advanced
/course/edx-introduction-to-analytics-modeling-8217,Introduction to Analytics Modeling,edx,advanced
/course/edx-designing-and-leading-learning-systems-7243,Designing and Leading Learning Systems,edx,advanced
/course/edx-multilevel-converters-for-medium-high-power-applications-10401,Multilevel Converters for Medium/High-Power Applications,edx,advanced
/course/edx-robotics-vision-intelligence-and-machine-learning-8203,Robotics: Vision Intelligence and Machine Learning,edx,advanced
/course/edx-robotics-dynamics-and-control-8196,Robotics: Dynamics and Control,edx,advanced
/course/edx-robotics-locomotion-engineering-8204,Robotics: Locomotion Engineering,edx,advanced
/course/edx-changing-minds-geographic-discoveries-and-new-worlds-through-the-eyes-of-a-renaissance-jewish-scholar-21211,Changing Minds: Geographic Discoveries and New Worlds through the Eyes of a Renaissance Jewish Scholar,edx,advanced
/course/in-the-margins-of-a-medieval-jewish-prayer-book-w-53017,In the Margins of a Medieval Jewish Prayer Book:  What Can Physical Manuscripts Tell Us about History?,edx,advanced
/course/edx-network-security-7858,Network Security,edx,advanced
/course/edx-improvement-science-in-education-7244,Improvement Science in Education,edx,advanced
/course/edx-leading-educational-innovation-and-improvement-capstone-7246,Leading Educational Innovation and Improvement Capstone,edx,advanced
/course/edx-case-studies-in-continuous-educational-improvement-7245,Case Studies in Continuous Educational Improvement,edx,advanced
/course/edx-big-data-and-education-968,Big Data and Education,edx,advanced
/course/edx-making-government-work-in-hard-places-4562,Making Government Work in Hard Places,edx,advanced
/course/edx-software-development-capstone-project-8198,Software Development Capstone Project,edx,advanced
/course/edx-international-human-rights-law-2917,International Human Rights Law,edx,advanced
/course/edx-effective-field-theory-2139,Effective Field Theory,edx,advanced
/course/edx-paradigms-of-computer-programming-fundamentals-2298,Paradigms of Computer Programming – Fundamentals,edx,advanced
/course/edx-paradigms-of-computer-programming-abstraction-and-concurrency-2630,Paradigms of Computer Programming – Abstraction and Concurrency,edx,advanced
/course/edx-big-data-analytics-using-spark-8221,Big Data Analytics Using Spark,edx,advanced
/course/edx-software-engineering-introduction-8205,Software Engineering: Introduction,edx,advanced
/course/edx-writing-case-studies-science-of-delivery-4908,Writing Case Studies: Science of Delivery,edx,advanced
/course/edx-digital-transformation-strategy-8208,Digital Transformation Strategy,edx,advanced
/course/edx-simulation-neuroscience-9539,Simulation Neuroscience,edx,advanced
/course/edx-data-analytics-for-business-8222,Data Analytics for Business,edx,advanced
/course/edx-sparse-representations-in-image-processing-from-theory-to-practice-9135,Sparse Representations in Image Processing: From Theory to Practice,edx,advanced
/course/edx-quantum-machine-learning-12860,Quantum Machine Learning,edx,advanced
/course/edx-hypersonics-from-shock-waves-to-scramjets-1647,Hypersonics – from Shock Waves to Scramjets,edx,advanced
/course/edx-product-management-with-lean-agile-and-system-design-thinking-8219,"Product Management with Lean, Agile and System Design Thinking",edx,advanced
/course/edx-internationalization-creating-digital-content-for-the-world-14386,Internationalization: Creating Digital Content for the World,edx,advanced
/course/edx-introduction-to-internationalization-and-localization-14385,Introduction to Internationalization and Localization,edx,advanced
/course/edx-localization-adapting-digital-content-to-local-markets-14387,Localization: Adapting Digital Content to Local Markets,edx,advanced
/course/edx-minerals-and-mining-in-a-sustainable-world-21001,Minerals and Mining in a Sustainable World,edx,advanced
/course/edx-introduction-to-predictive-analytics-using-python-14420,Introduction to Predictive Analytics using Python,edx,advanced
/course/stability-and-design-of-steel-frames-41000,Stability and Design of Structural Frames,edx,advanced
/course/edx-fiber-optic-communications-17379,Fiber Optic Communications,edx,advanced
/course/advanced-skills-for-the-use-of-biosimilars-and-bi-59784,Advanced Knowledge and Skills of Originator and Biosimilar Biologics: For Healthcare Providers,edx,advanced
/course/edx-data-mining-theories-and-algorithms-for-tackling-big-data-8130,Data Mining: Theories and Algorithms for Tackling Big Data | 数据挖掘：理论与算法,edx,advanced
/course/edx-autonomous-navigation-for-flying-robots-1911,Autonomous Navigation for Flying Robots,edx,advanced
/course/the-program-manager-applying-power-skills-and-dig-58655,The Program Manager – Applying Power Skills and Digital Enablers to Create Continual Change,edx,advanced
/course/edx-automated-software-testing-model-and-state-based-testing-12039,Automated Software Testing: Model and State-based Testing,edx,advanced
/course/edx-co-creating-sustainable-cities-12638,Co-Creating Sustainable Cities,edx,advanced
/course/edx-biospecimen-research-methods-7585,Biospecimen Research Methods,edx,advanced
/course/edx-fundamentals-of-biomedical-imaging-magnetic-resonance-imaging-mri-7058,Fundamentals of Biomedical Imaging: Magnetic Resonance Imaging (MRI),edx,advanced
/course/edx-a-resilient-future-science-and-technology-for-disaster-risk-reduction-7218,A Resilient Future: Science and Technology for Disaster Risk Reduction,edx,advanced
/course/edx-dementia-and-diversity-in-primary-care-a-primer-guidelines-ethnic-differences-and-assessment-10468,"Dementia and Diversity in Primary Care: A Primer - Guidelines, Ethnic Differences, and Assessment",edx,advanced
/course/edx-introduction-to-food-health-10467,Introduction To Food & Health,edx,advanced
/course/operational-foundations-of-mining-21890,Operational Foundations of Mining,edx,advanced
/course/edx-pricing-options-with-mathematical-models-2318,Pricing Options with Mathematical Models,edx,advanced
/course/edx-predictive-analytics-4867,Predictive Analytics,edx,advanced
/course/edx-discrete-time-signals-and-systems-part-1-time-domain-1236,"Discrete Time Signals and Systems, Part 1: Time Domain",edx,advanced
/course/edx-chinese-cultural-communication-7370,汉语与文化交际 Chinese Cultural Communication,edx,advanced
/course/edx-drug-discovery-and-its-target-4416,新药发现和药物靶点 | Drug Discovery and its Target,edx,advanced
/course/edx-machine-learning-15170,Machine Learning,edx,advanced
/course/edx-advanced-linear-algebra-foundations-to-frontiers-17390,Advanced Linear Algebra: Foundations to Frontiers,edx,advanced
/course/edx-cybersecurity-risk-management-7845,Cybersecurity Risk Management,edx,advanced
/course/edx-computer-forensics-7857,Computer Forensics,edx,advanced
/course/edx-leaders-in-global-development-18100,Leaders in Global Development,edx,advanced
/course/edx-adaptive-leadership-in-development-18102,Adaptive Leadership in Development,edx,advanced
/course/edx-the-science-and-practice-of-sustainable-development-18101,The Science and Practice of Sustainable Development,edx,advanced
/course/edx-critical-development-perspectives-18103,Critical Development Perspectives,edx,advanced
/course/health-safety-and-wellness-in-mining-22045,"Health, Safety and Wellness in Mining",edx,advanced
/course/leadership-and-diversity-in-mining-21929,Leadership and Diversity in Mining,edx,advanced
/course/edx-business-analytics-for-data-driven-decision-making-8215,Business Analytics for Data-Driven Decision Making,edx,advanced
/course/edx-international-humanitarian-law-7258,International Humanitarian Law,edx,advanced
/course/edx-unconscious-bias-in-medicine-10455,Unconscious Bias in Medicine,edx,advanced
/course/edx-drainage-in-agriculture-controlling-water-and-salt-levels-in-the-soil-13651,Drainage in Agriculture: controlling water and salt levels in the soil,edx,advanced
/course/edx-the-postdoc-academy-succeeding-as-a-postdoc-17221,The Postdoc Academy: Succeeding as a Postdoc,edx,advanced
/course/the-postdoc-academy-building-skills-for-a-success-47297,The Postdoc Academy: Building Skills for a Successful Career,edx,advanced
/course/edx-international-investment-law-7259,International Investment Law,edx,advanced
/course/edx-html5-apps-and-games-4671,HTML5 Apps and Games,edx,advanced
/course/edx-buyer-behaviour-and-analysis-8170,Buyer Behaviour and Analysis,edx,advanced
/course/edx-semiconductor-fundamentals-11697,Semiconductor Fundamentals,edx,advanced
/course/edx-nanophotonic-modeling-6455,Nanophotonic Modeling,edx,advanced
/course/edx-from-atoms-to-materials-predictive-theory-and-simulations-8729,From Atoms to Materials: Predictive Theory and Simulations,edx,advanced
/course/edx-fundamentals-of-transistors-11882,Fundamentals of Transistors,edx,advanced
/course/edx-the-physics-of-electronic-polymers-pep-8151,The Physics of Electronic Polymers (PEP),edx,advanced
/course/edx-applied-quantum-computing-i-fundamentals-21183,Applied Quantum Computing I: Fundamentals,edx,advanced
/course/edx-fundamentals-of-current-flow-11781,Fundamentals of Current Flow,edx,advanced
/course/edx-introduction-to-quantum-transport-11881,Introduction to Quantum Transport,edx,advanced
/course/bim-for-construction-52892,BIM for Construction,edx,advanced
/course/fundamentals-of-building-information-modeling-52894,Fundamentals of Building Information Modeling,edx,advanced
/course/edx-primer-on-rf-design-21143,Primer on RF Design,edx,advanced
/course/edx-rf-system-design-21145,RF System Design,edx,advanced
/course/edx-applied-quantum-computing-iii-algorithm-and-software-21186,Applied Quantum Computing III: Algorithm and Software,edx,advanced
/course/introduction-to-deep-learning-2-33404,Introduction to Deep Learning,edx,advanced
/course/edx-solid-state-devices-1-21011,Solid State Devices 1,edx,advanced
/course/edx-boltzmann-law-physics-to-computing-21012,Boltzmann Law: Physics to Computing,edx,advanced
/course/edx-applied-quantum-computing-ii-hardware-21185,Applied Quantum Computing II: Hardware,edx,advanced
/course/computational-watershed-hydrology-53422,Computational Watershed Hydrology,edx,advanced
/course/introduction-to-machine-learning-2-47957,Introduction to Scientific Machine Learning,edx,advanced
/course/analysis-and-design-of-water-distribution-systems-33473,Analysis and Design of Water Distribution Systems,edx,advanced
/course/edx-quantum-detectors-and-sensors-21181,Quantum Detectors and Sensors,edx,advanced
/course/buckling-and-design-of-steel-members-40311,Stability and Design of Structural Members,edx,advanced
/course/edx-rf-design-passive-and-active-components-21436,RF Design: Passive and Active Components,edx,advanced
/course/plastics-in-infrastructure-and-the-environment-32157,Plastics in Infrastructure and the Environment,edx,advanced
/course/groundwater-cycle-22590,Groundwater Cycle,edx,advanced
/course/edx-quantum-detectors-21184,Quantum Detectors,edx,advanced
/course/groundwater-contamination-22712,Groundwater Contamination,edx,advanced
/course/wells-hydraulics-22713,Wells Hydraulics,edx,advanced
/course/design-of-urban-storm-sewer-systems-33472,Design of Urban Water Management Structures,edx,advanced
/course/design-of-sanitary-sewer-systems-33471,Design of Sanitary Sewer Systems,edx,advanced
/course/elastic-buckling-and-behavior-of-members-35081,Elastic Stability and Behavior of Members,edx,advanced
/course/computer-applications-of-artificial-intelligence--52912,Computer Applications of Artificial Intelligence and e-Construction,edx,advanced
/course/computer-vision-for-embedded-systems-96635,Computer Vision for Embedded Systems,edx,advanced
/course/the-program-management-office-pmo-the-strategy-ex-58654,The Program Management Office (PMO) - The Strategy Execution Arm,edx,advanced
/course/benefits-realization-management-brm-linking-strat-58652,Creating an Organizational Change Management Framework - Transforming Strategy Execution to Realize Program Value,edx,advanced
/course/edx-project-finance-funding-projects-successfully-8451,Project Finance: Funding Projects Successfully,edx,advanced
/course/edx-project-management-mastering-complexity-8249,Project Management: Mastering Complexity,edx,advanced
/course/edx-engineering-design-for-a-circular-economy-10282,Engineering Design for a Circular Economy,edx,advanced
/course/edx-solar-energy-engineering-comprehensive-exams-19082,Solar Energy Engineering: Comprehensive Exams,edx,advanced
/course/fundamentals-of-quantum-information-34203,Fundamentals of Quantum Information,edx,advanced
/course/edx-neuronal-dynamics-2685,Neuronal Dynamics,edx,advanced
/course/edx-micro-and-nanofabrication-mems-6880,Micro and Nanofabrication (MEMS),edx,advanced
/course/edx-fundamentals-of-biomedical-imaging-ultrasounds-x-ray-positron-emission-tomography-pet-and-applications-7074,"Fundamentals of Biomedical Imaging: Ultrasounds, X-ray, positron emission tomography (PET) and applications",edx,advanced
/course/edx-computational-neuroscience-neuronal-dynamics-of-cognition-10423,Computational Neuroscience: Neuronal Dynamics of Cognition,edx,advanced
