Link,Title,Platform,Level
/course/edx-cybersecurity-capstone-7873,Cybersecurity Capstone,edx,advanced
/course/edx-driving-digital-innovation-through-experimentation-8207,Driving Digital Innovation through Experimentation,edx,advanced
/course/design-of-steel-concrete-composite-structures-22576,Design of Steel-Concrete Composite Structures,edx,advanced
/course/connections-in-steel-structures-22579,Connections in Steel Structures,edx,advanced
/course/fundamentals-of-prestressed-concrete-22578,Fundamentals of Prestressed Concrete,edx,advanced
/course/steel-beam-and-plate-girder-design-22581,Steel Beam and Plate Girder Design,edx,advanced
/course/post-tensioned-structures-22577,Post-Tensioned Structures,edx,advanced
/course/biological-principles-in-wastewater-treatment-48249,Biological Principles in Wastewater Treatment,edx,advanced
/course/pretensioned-structures-22580,Pretensioned Structures,edx,advanced
/course/modern-biotechnologies-for-wastewater-treatmen-48248,Modern Biotechnologies for Wastewater Treatment,edx,advanced
/course/nutrient-removal-and-resource-recovery-in-wastewa-48247,Nutrient Removal and Resource Recovery in Wastewater,edx,advanced
/course/smart-logistics-and-supply-chains-51846,Smart Logistics and Supply Chains,edx,advanced
/course/lighting-and-daylighting-design-of-buildings-34260,Lighting and Daylighting Design of Buildings,edx,advanced
/course/corporate-renewable-procurement-opportunities-in--22098,Corporate Renewable Procurement: Opportunities in India,edx,advanced
/course/edx-data-analysis-for-decision-making-11673,Data Analysis for Decision Making,edx,advanced
/course/edx-corporate-finance-11675,Corporate Finance,edx,advanced
/course/edx-global-business-strategy-11676,Global Business Strategy,edx,advanced
/course/edx-project-management-micromasters-capstone-exam-8251,Project Management MicroMasters Capstone Exam,edx,advanced
/course/edx-natural-language-processing-and-language-understanding-in-educational-research-9136,Natural Language Processing and Language Understanding in Educational Research,edx,advanced
/course/edx-integrated-digital-media-capstone-13441,Integrated Digital Media Capstone,edx,advanced
/course/edx-financial-reporting-i-13787,Financial Reporting I,edx,advanced
/course/edx-road-traffic-safety-in-automotive-engineering-10290,Road Traffic Safety in Automotive Engineering,edx,advanced
/course/edx-taxes-and-decision-making-13789,Taxes and Decision Making,edx,advanced
/course/edx-managerial-accounting-and-corporate-control-13788,Managerial Accounting and Corporate Control,edx,advanced
/course/edx-global-marketing-strategy-7263,Global Marketing Strategy,edx,advanced
/course/selected-chapters-of-quantum-mechanics-for-modern-59489,Selected chapters of quantum mechanics for modern engineering,edx,advanced
/course/personal-identification-in-forensics-current-prob-58283,Personal Identification in Forensics: Current Problems and Trends,edx,advanced
/course/edx-predictive-analytics-final-project-14424,Predictive Analytics Final Project,edx,advanced
/course/edx-design-leadership-and-innovation-6647,Design Leadership and Innovation,edx,advanced
/course/edx-how-to-save-a-life-pediatric-advanced-life-support-5202,How to Save a Life: Pediatric Advanced Life Support,edx,advanced
/course/edx-capstone-assessment-leadership-in-global-development-8657,Capstone Assessment: Leadership in Global Development,edx,advanced
